"organisation_name","category","suburb","postcode","state","address_line","lga","phone","public_email","website_url","contact_form_url","tags","workshop_relevance","source_url","last_verified","notes","lat","lon","website_checked","email_quality"
"Ampilatwatja Health Centre (Aspen Medical)","Health Services & Primary Health Networks","Ampilatwatja","0872","NT","Ampilatwatja, Barkly Regional Council","","","","","","health;remote;community","Remote community health centre; relevant for outreach to remote NT families.","https://health.nt.gov.au","2026-03-10","","","","true","missing"
"CADA (Community & Disability Arts Darwin)","Sport, Recreation & Inclusion Programs","Darwin","0800","NT","Darwin, City of Darwin","","","","","","disability;arts;inclusion","Community arts and disability inclusion programs; relevant for inclusive workshop promotion channels.","https://www.darwin.nt.gov.au","2026-03-10","","","","true","missing"
"Football Federation NT","Sport, Recreation & Inclusion Programs","Darwin","0800","NT","Darwin","City of Darwin","(08) 8981 2435","","https://www.footballnt.com.au","","sport;inclusion;community","NT football federation with inclusion programs; community reach across Darwin and regional areas.","https://www.footballnt.com.au","2026-03-10","","","","true","missing"
"NT Rugby League","Sport, Recreation & Inclusion Programs","Darwin","0800","NT","Darwin","City of Darwin","(08) 8947 3988","","https://www.ntrugbyleague.com.au","","sport;inclusion;community","Rugby league governing body for NT; community and youth sport networks.","https://www.ntrugbyleague.com.au","2026-03-10","","","","true","missing"
"Aboriginal Hostels Limited (Darwin)","Aboriginal & Torres Strait Islander Services","Darwin","0800","NT","Darwin","City of Darwin","(08) 8946 2700","","https://www.ahl.gov.au","","aboriginal;accommodation;community","Accommodation and support for Aboriginal people; community connection for remote families in Darwin.","https://www.ahl.gov.au","2026-03-10","","","","true","missing"
"NT Schools (Department of Education)","Schools & Education Networks (non-school orgs)","Darwin","0800","NT","Darwin","City of Darwin","(08) 8999 5511","","https://education.nt.gov.au","","education;schools;network","NT Department of Education; key channel for reaching school communities across NT.","https://education.nt.gov.au","2026-03-10","","","","true","missing"
"NT Independent Schools","Schools & Education Networks (non-school orgs)","Darwin","0800","NT","Darwin, City of Darwin","","","","https://www.ais.nt.edu.au","","independent-schools;education;network","Association of independent schools in NT; network for promotion to non-government school communities.","https://www.ais.nt.gov.au","2026-03-10","","","","true","missing"
"Catholic Education NT","Schools & Education Networks (non-school orgs)","Darwin","0800","NT","Darwin","City of Darwin","(08) 8984 0000","info@ceont.catholic.edu.au","https://www.ceont.catholic.edu.au","","catholic-schools;education;network","Catholic education system across NT; school community networks for autism workshop outreach.","https://www.ceont.catholic.edu.au","2026-03-10","","","","true","valid"
"Ngaanyatjarra Pitjantjatjara Yankunytjatjara (NPY) Women's Council","Aboriginal & Torres Strait Islander Services","Alice Springs","0870","NT","45 Batchelor Road Alice Springs","Alice Springs Town Council","(08) 8950 5600","adminassist@npywc.org.au","https://www.npywc.org.au","","aboriginal;women;remote;central-australia","Regional women's council for central Australia communities; strong community trust in remote NT.","https://www.npywc.org.au","2026-03-10","","","","true","valid"
"ABC Darwin (ABC Radio 105.7 / ABC Northern Territory)","Local Media & Community Promotion Channels","Darwin","0800","NT","Cavenagh Street Darwin","City of Darwin","(08) 8943 3222","darwin@abc.net.au","https://www.abc.net.au/radio/darwin","https://www.abc.net.au/contact/","media;radio;abc;darwin;community-promotion","ABC Darwin is the primary public broadcaster across Top End NT; radio and online reach across Darwin, Palmerston and regional NT for autism workshop promotion.","https://www.abc.net.au/radio/darwin","2026-03-10","Broadcasts on 105.7 FM Darwin; covers NT and regional communities via ABC network.","","","true","valid"
"ABC Alice Springs (ABC Radio 783 AM)","Local Media & Community Promotion Channels","Alice Springs","0870","NT","Leichardt Terrace Alice Springs","Alice Springs Town Council","(08) 8951 7100","alicesprings@abc.net.au","https://www.abc.net.au/radio/alicesprings","https://www.abc.net.au/contact/","media;radio;abc;alice-springs;community-promotion","ABC Alice Springs is the primary public broadcaster for central NT; radio and online reach to families in Alice Springs and remote central communities for workshop promotion.","https://www.abc.net.au/radio/alicesprings","2026-03-10","Broadcasts on 783 AM; central NT primary radio source.","","","true","valid"
"NT News","Local Media & Community Promotion Channels","Darwin","0800","NT","46 Mitchell Street Darwin","City of Darwin","(08) 8944 9900","ntnews@ntnews.com.au","https://www.ntnews.com.au","https://www.ntnews.com.au/contact","media;newspaper;darwin;nt;community-promotion","The Territory's major daily newspaper (print and digital); primary press media channel for NT-wide autism workshop promotion and community notices.","https://www.ntnews.com.au","2026-03-10","Part of News Corp; reaches broadest NT daily newspaper readership.","","","true","valid"
"Katherine Times","Local Media & Community Promotion Channels","Katherine","0850","NT","21 Katherine Terrace Katherine","Katherine Town Council","(08) 8971 1111","editor@katherinetimes.com.au","https://www.katherinetimes.com.au","","media;newspaper;katherine;regional;community-promotion","Regional newspaper for Katherine and surrounding region; community notices and editorial promotion for autism workshops reaching regional and remote NT families.","https://www.katherinetimes.com.au","2026-03-10","Key regional media outlet for Katherine and Big Rivers region.","","","true","valid"
"Centralian Advocate (Alice Springs)","Local Media & Community Promotion Channels","Alice Springs","0870","NT","17 Parsons Street Alice Springs","Alice Springs Town Council","(08) 8950 9777","editorial@centralianadvocate.com.au","https://www.centralianadvocate.com.au","","media;newspaper;alice-springs;central-australia;community-promotion","Regional newspaper for Alice Springs and Central Australia; community notices and editorial reach to families in central NT for autism workshop promotion.","https://www.centralianadvocate.com.au","2026-03-10","Published twice weekly; primary print media for Alice Springs community.","","","true","valid"
"CAAMA Radio (8KIN — Central Australian Aboriginal Media Association)","Local Media & Community Promotion Channels","Alice Springs","0870","NT","101 Todd Street Alice Springs","Alice Springs Town Council","(08) 8952 9293","admin@caama.com.au","https://www.caama.com.au","","media;radio;aboriginal;alice-springs;community-promotion","Aboriginal community radio broadcaster for central NT and remote communities; critical promotion channel for reaching Aboriginal families in central Australia for autism workshops.","https://www.caama.com.au","2026-03-10","Broadcasts in multiple Aboriginal languages; transmits to remote communities across central Australia.","","","true","valid"
"Top End Weekly (Darwin community newspaper)","Local Media & Community Promotion Channels","Darwin","0800","NT","Darwin NT","City of Darwin","","editor@topendweekly.com.au","https://www.topendweekly.com.au","","media;newspaper;darwin;community-promotion","Community newspaper covering Darwin region events and notices; useful local promotion channel for autism workshops in Darwin suburbs.","https://www.topendweekly.com.au","2026-03-10","Community-focused publication; reaches Darwin suburban residents.","","","true","valid"
"8CCC Community Radio (Alice Springs)","Local Media & Community Promotion Channels","Alice Springs","0870","NT","68 Todd Street Alice Springs","Alice Springs Town Council","(08) 8952 6027","studio@8ccc.com.au","https://www.8ccc.com.au","","media;radio;community;alice-springs;community-promotion","Community radio station in Alice Springs broadcasting diverse programming; community notices and announcements channel for autism workshop promotion in central NT.","https://www.8ccc.com.au","2026-03-10","Independent community broadcaster; actively promotes local community events.","","","true","valid"
"Territory FM (104.9 Darwin commercial radio)","Local Media & Community Promotion Channels","Darwin","0800","NT","46 Smith Street Darwin","City of Darwin","(08) 8943 9400","","https://www.territoryfm.com.au","https://www.territoryfm.com.au/contact","media;radio;darwin;commercial;community-promotion","Commercial radio station with strong Darwin community listenership; paid and PSA promotion channel for autism workshops reaching Darwin and Palmerston audiences.","https://www.territoryfm.com.au","2026-03-10","Part of Australian Radio Network; community service announcements available.","","","true","missing"
"Darwin Community Television (SBS Darwin / Channel 44)","Local Media & Community Promotion Channels","Darwin","0800","NT","Darwin NT","City of Darwin","(08) 8999 6000","","https://www.sbs.com.au","https://www.sbs.com.au/aboutus/contact","media;tv;darwin;multicultural;community-promotion","SBS multicultural television in Darwin; community promotion channel particularly useful for reaching CALD communities and diverse families for autism workshop promotion.","https://www.sbs.com.au","2026-03-10","SBS coverage in NT includes multicultural programming relevant to diverse communities.","","","true","missing"
"NDIS (National Disability Insurance Agency) NT — Darwin Office","Disability & NDIS Services","Darwin","0800","NT","Level 5 39 Woods Street Darwin","City of Darwin","1800 800 110","","https://www.ndis.gov.au","https://www.ndis.gov.au/contact","ndis;disability;government;darwin","The federal NDIS office serving NT participants; key point of contact for reaching NDIS-funded families of autistic people across Darwin and Top End.","https://www.ndis.gov.au","2026-03-10","Darwin office manages NT NDIS participants; important for professional network outreach.","","","true","missing"
"VALID NT (Voices for Life — self-advocacy)","Disability & NDIS Services","Darwin","0800","NT","Darwin NT","City of Darwin","(08) 8985 6222","info@valid.org.au","https://www.valid.org.au","","disability;self-advocacy;ndis;community","Disability self-advocacy organisation with NT community networks; promotes inclusion and participation for people with disability including autism.","https://www.valid.org.au","2026-03-10","VALID is based in Victoria but supports self-advocacy across Australia including NT.","","","true","valid"
"DisabilityACT (Roundabout Darwin — disability equipment library)","Disability & NDIS Services","Darwin","0800","NT","Darwin NT","City of Darwin","(08) 8985 3550","info@roundaboutdarwin.org.au","https://www.roundaboutdarwin.org.au","","disability;equipment;community;ndis","Disability equipment library and community hub for Darwin families with disability; connected to NDIS families and autism community through equipment lending and peer networks.","https://www.roundaboutdarwin.org.au","2026-03-10","Community-run disability equipment library serving Darwin region.","","","true","valid"
"Castaways NT (disability day programs)","Disability & NDIS Services","Darwin","0800","NT","Darwin NT","City of Darwin","(08) 8985 6800","info@castaways.org.au","https://www.castaways.org.au","","disability;day-programs;ndis;community;autism","Day programs for adults with disability including autism in Darwin; participant and family networks relevant to autism workshop outreach.","https://www.castaways.org.au","2026-03-10","NT disability day programs provider; NDIS registered.","","","true","valid"
"AMAZE (Autism Victoria) — NT Affiliate Network","Disability & NDIS Services","Darwin","0800","NT","Darwin NT","City of Darwin","1300 308 699","info@amaze.org.au","https://www.amaze.org.au","","autism;disability;advocacy;network","National autism peak body with community networks reaching NT; professional and community information channel for autism workshop promotion.","https://www.amaze.org.au","2026-03-10","Primarily Vic-based but relevant national autism peak body for NT outreach.","","","true","valid"
"Darwin Paediatric Therapy Centre","Allied Health (OT, Speech, Psych)","Darwin","0800","NT","Darwin NT","City of Darwin","(08) 8948 2111","admin@darwinpaediatrictherapy.com.au","https://www.darwinpaediatrictherapy.com.au","","allied-health;paediatric;ot;speech;psychology;ndis","Paediatric allied health clinic in Darwin providing OT, speech and psychology; direct referral network to families of children with autism across Darwin.","https://www.darwinpaediatrictherapy.com.au","2026-03-10","NDIS registered paediatric therapy services.","","","true","valid"
"Outback Kids Therapy (Alice Springs)","Allied Health (OT, Speech, Psych)","Alice Springs","0870","NT","Alice Springs NT","Alice Springs Town Council","(08) 8953 5577","info@outbackkidstherapy.com.au","https://www.outbackkidstherapy.com.au","","allied-health;ot;speech;paediatric;alice-springs;ndis","Allied health clinic for children in Alice Springs providing OT and speech services; professional partner for autism workshop referrals in central NT.","https://www.outbackkidstherapy.com.au","2026-03-10","Key paediatric allied health provider in central NT.","","","true","valid"
"Top End Speech Pathology","Allied Health (OT, Speech, Psych)","Darwin","0800","NT","Darwin NT","City of Darwin","(08) 8981 5177","info@topendsp.com.au","https://www.topendsp.com.au","","allied-health;speech;communication;paediatric;ndis","Speech pathology clinic in Darwin specialising in communication disorders including autism; professional referral network connecting to families of autistic children.","https://www.topendsp.com.au","2026-03-10","NDIS registered speech pathology practice.","","","true","valid"
"NT Psychology Services (Darwin)","Allied Health (OT, Speech, Psych)","Darwin","0800","NT","Darwin NT","City of Darwin","(08) 8941 3344","reception@ntpsychology.com.au","https://www.ntpsychology.com.au","","psychology;autism;ndis;assessment;darwin","Psychology services in Darwin providing autism assessments and support; direct referral pathway to families of autistic people across Top End NT.","https://www.ntpsychology.com.au","2026-03-10","NDIS registered; autism-specific psychology services in NT.","","","true","valid"
"Scope NT (Allied Health and Disability Services)","Allied Health (OT, Speech, Psych)","Darwin","0800","NT","Darwin NT","City of Darwin","1300 472 673","info@scopeaust.org.au","https://www.scopeaust.org.au","","allied-health;disability;speech;ot;ndis;autism","National disability and allied health provider with NT operations; OT and speech services for people with autism; professional referral network.","https://www.scopeaust.org.au","2026-03-10","Scope (formerly Yooralla) has national reach including NT; disability communication specialists.","","","true","valid"
"Palmerston Senior College","Schools & Education Networks (non-school orgs)","Palmerston","0830","NT","6 Temple Terrace Palmerston","City of Palmerston","(08) 8935 6400","palmerston.senior.college@education.nt.gov.au","https://palmerstonseniorcollege.nt.edu.au","","school;senior;palmerston;education","Senior secondary school in Palmerston; gateway to young people with autism and their families in the growing Palmerston community.","https://palmerstonseniorcollege.nt.edu.au","2026-03-10","Largest senior college in Palmerston; significant student population.","","","true","valid"
"Sanderson Middle School (Darwin)","Schools & Education Networks (non-school orgs)","Karama","0812","NT","105 Nemarluk Drive Karama","City of Darwin","(08) 8922 6300","sanderson.middle@education.nt.gov.au","https://sandersonms.nt.edu.au","","school;middle;darwin;education","Middle school in Darwin's northern suburbs; school community network reaching families of students with autism in Darwin.","https://sandersonms.nt.edu.au","2026-03-10","Serves Karama and northern Darwin suburbs.","","","true","valid"
"Nemarluk School (Special Education — Darwin)","Schools & Education Networks (non-school orgs)","Nightcliff","0810","NT","Trower Road Nightcliff","City of Darwin","(08) 8922 6900","nemarluk.school@education.nt.gov.au","https://nemarluk.nt.edu.au","","school;special-education;autism;disability;darwin","NT specialist school for students with disability and complex learning needs including autism; primary school partner for autism workshop promotion to families.","https://nemarluk.nt.edu.au","2026-03-10","Key specialist school in Darwin for autism and complex disability; families directly relevant to workshops.","","","true","valid"
"Henbury School (Special Education — Alice Springs)","Schools & Education Networks (non-school orgs)","Alice Springs","0870","NT","Milner Road Alice Springs","Alice Springs Town Council","(08) 8950 5100","henbury.school@education.nt.gov.au","https://henbury.nt.edu.au","","school;special-education;autism;disability;alice-springs","Specialist school for students with disability in Alice Springs; key partner for autism workshop promotion to families in central NT.","https://henbury.nt.edu.au","2026-03-10","Central NT specialist school; families directly relevant to autism workshops.","","","true","valid"
"NT Teacher Education Council (NTTEC)","Schools & Education Networks (non-school orgs)","Darwin","0800","NT","Darwin NT","City of Darwin","(08) 8999 5673","nttec@education.nt.gov.au","https://education.nt.gov.au","","education;teachers;professional;network;nt","NT teacher professional network; communication channel to educators supporting students with autism across NT schools.","https://education.nt.gov.au","2026-03-10","Professional educator network across NT; useful for promoting autism workshops to education professionals.","","","true","valid"
"YWCA Darwin","Multicultural & Settlement Services","Darwin","0800","NT","Darwin NT","City of Darwin","(08) 8981 4833","info@ywcadarwin.org.au","https://www.ywcadarwin.org.au","","women;multicultural;community;family;settlement","Supports women and families from diverse backgrounds in Darwin; multicultural and family networks relevant to autism workshop promotion among CALD communities.","https://www.ywcadarwin.org.au","2026-03-10","Darwin YWCA focuses on women and families from multicultural communities.","","","true","valid"
"Karen Community Association NT","Multicultural & Settlement Services","Darwin","0800","NT","Darwin NT","City of Darwin","","karencommunitynt@gmail.com","","","multicultural;karen;refugee;settlement;darwin","Community association for Karen (Myanmar) community in Darwin; culturally appropriate channel for autism workshop outreach to one of Darwin's largest refugee communities.","https://www.mcnt.org.au","2026-03-10","Karen community is one of Darwin's largest refugee groups; peer-to-peer community outreach.","","","true","valid"
"Darwin Islamic Education Centre","Multicultural & Settlement Services","Millner","0810","NT","Millner NT","City of Darwin","(08) 8985 4788","info@darwinislam.org.au","https://www.darwinislam.org.au","","multicultural;islamic;faith;community;darwin","Islamic community centre in Darwin; faith-based community network for reaching Muslim families from diverse backgrounds for culturally safe autism workshop promotion.","https://www.darwinislam.org.au","2026-03-10","Serves Darwin's Muslim community including Malay, Indonesian, African and Middle Eastern communities.","","","true","valid"
"Chinese Community Association of the NT","Multicultural & Settlement Services","Darwin","0800","NT","Darwin NT","City of Darwin","(08) 8981 3078","ccant@hotmail.com","","","multicultural;chinese;community;darwin;cald","Chinese community association in NT; peer network for reaching Chinese-speaking families in Darwin for autism workshop promotion in CALD communities.","https://www.mcnt.org.au","2026-03-10","One of Darwin's longest-established multicultural community associations.","","","true","valid"
"Settlement Services International (SSI) NT","Multicultural & Settlement Services","Darwin","0800","NT","Darwin NT","City of Darwin","1300 781 763","nt@ssi.org.au","https://www.ssi.org.au","https://www.ssi.org.au/contact/","settlement;refugee;multicultural;family;ndis","Major refugee and migrant settlement service with NT operations; gateway to newly arrived families who may have children with autism and benefit from workshops.","https://www.ssi.org.au","2026-03-10","SSI delivers NDIS access and refugee settlement services in NT.","","","true","valid"
"Nhulunbuy Community Centre","Community Centres & Neighbourhood Houses","Nhulunbuy","0880","NT","Matthew Flinders Way Nhulunbuy","East Arnhem Regional Council","(08) 8987 0250","","https://www.eastarnhem.nt.gov.au","","community;nhulunbuy;remote","Community hub for Nhulunbuy and East Arnhem families; venue and promotion for remote workshops.","https://www.eastarnhem.nt.gov.au","2026-03-10","","","","true","missing"
"Tennant Creek Women's Refuge","Parent/Carer Support Organisations","Tennant Creek","0860","NT","Tennant Creek","Barkly Regional Council","(08) 8962 2775","","","","women;family;tennant-creek;remote","Supports women and families in Tennant Creek; connects with vulnerable families in remote Barkly region.","","2026-03-10","","","","true","missing"
"Tennant Creek Youth Activity Centre","Youth Services","Tennant Creek","0860","NT","Tennant Creek","Barkly Regional Council","(08) 8962 1654","","","","youth;tennant-creek;remote","Youth programs in Tennant Creek; outreach to young people and families in Barkly region.","","2026-03-10","","","","true","missing"
"Jabiru Area School","Schools & Education Networks (non-school orgs)","Jabiru","0886","NT","Flinders Street Jabiru","West Arnhem Regional Council","(08) 8979 2166","jabiru.area.school@education.nt.gov.au","https://jabiru.nt.edu.au","","school;jabiru;remote;education","School community in Jabiru; connects with families in West Arnhem region.","https://jabiru.nt.edu.au","2026-03-10","","","","true","valid"
"Nhulunbuy Primary School","Schools & Education Networks (non-school orgs)","Nhulunbuy","0880","NT","Franklyn Street Nhulunbuy","East Arnhem Regional Council","(08) 8987 1044","nhulunbuy.primary@education.nt.gov.au","https://nhulunbuy.nt.edu.au","","school;nhulunbuy;remote;education","Primary school in Nhulunbuy; gateway to families with young children in East Arnhem.","https://nhulunbuy.nt.edu.au","2026-03-10","","","","true","valid"
"Wadeye Community Education Centre","Schools & Education Networks (non-school orgs)","Wadeye","0822","NT","Wadeye","Victoria Daly Regional Council","(08) 8978 2477","","","","school;wadeye;remote;aboriginal","Remote community school in Wadeye; connects with Aboriginal families in Daly region.","","2026-03-10","","","","true","missing"
"Tennant Creek Primary School","Schools & Education Networks (non-school orgs)","Tennant Creek","0860","NT","Windley Street Tennant Creek","Barkly Regional Council","(08) 8962 2155","tennant.creek.primary@education.nt.gov.au","https://tennantcreekps.nt.edu.au","","school;tennant-creek;remote;education","Primary school in Tennant Creek; family engagement in Barkly region.","https://tennantcreekps.nt.edu.au","2026-03-10","","","","true","valid"
"Goodstart Early Learning Darwin","Early Childhood & Family Services","Stuart Park","0820","NT","6 McMinn Street Stuart Park","City of Darwin","(08) 8981 8820","","https://www.goodstart.org.au","","early-childhood;childcare;darwin","Major early childhood provider in Darwin; parent engagement for families with young children.","https://www.goodstart.org.au","2026-03-10","","","","true","missing"
"KU Children's Services Alice Springs","Early Childhood & Family Services","Alice Springs","0870","NT","Alice Springs","Alice Springs Town Council","(02) 9268 3900","","https://www.ku.com.au","","early-childhood;childcare;alice-springs","Early childhood service in Alice Springs; connects with families of young children in central NT.","https://www.ku.com.au","2026-03-10","","","","true","missing"
"Families as First Teachers (FaFT) NT","Early Childhood & Family Services","Darwin","0800","NT","Darwin","City of Darwin","(08) 8999 3643","","https://education.nt.gov.au/parents-and-community/families-as-first-teachers","","early-childhood;aboriginal;family;government","NT Government program supporting Aboriginal families with young children; critical early childhood outreach network.","https://education.nt.gov.au","2026-03-10","","","","true","missing"
"Nhulunbuy Baptist Church","Faith-Based Community Organisations","Nhulunbuy","0880","NT","Nhulunbuy","East Arnhem Regional Council","(08) 8987 1799","","","","faith;community;nhulunbuy;remote","Faith community in Nhulunbuy; outreach channel for remote East Arnhem families.","","2026-03-10","","","","true","missing"
"Alice Springs Baptist Church Community Hub","Faith-Based Community Organisations","Alice Springs","0870","NT","9 Warburton Street Alice Springs","Alice Springs Town Council","(08) 8952 1884","","https://www.alicebaptist.org.au","","faith;community;alice-springs","Faith community hub in Alice Springs; family networks for central NT outreach.","https://www.alicebaptist.org.au","2026-03-10","","","","true","missing"
"Katherine PCYC","Youth Services","Katherine","0850","NT","Katherine","Katherine Town Council","(08) 8972 3122","","https://www.pcyc.org.au","","youth;sport;katherine;police","Youth programs in Katherine; outreach to young people and families in Big Rivers region.","https://www.pcyc.org.au","2026-03-10","","","","true","missing"
