"organisation_name","category","suburb","postcode","state","address_line","lga","phone","public_email","website_url","contact_form_url","tags","workshop_relevance","source_url","last_verified","notes","lat","lon","website_checked","email_quality"
"Communities@Work — Gungahlin Child Care & Community","Early Childhood & Family Services","Gungahlin","2912","ACT","Gungahlin ACT, Unincorporated ACT","02 6293 6500","marketing@commsatwork.org","https://www.commsatwork.org","","early childhood;community;Gungahlin;family;child care","Communities@Work early childhood and community services in Gungahlin — can promote autism workshops to families of young children in north Canberra.","https://www.commsatwork.org/services/children-services/","2026-03-10","Part of Communities@Work broader network.","","","","true","valid"
"ACT Education Directorate — Disability Education","Schools & Education Networks (non-school orgs)","Canberra City","2601","ACT","220 Northbourne Avenue Braddon, Unincorporated ACT","","","https://www.education.act.gov.au","","education;disability;schools;specialist;government","Government body overseeing specialist disability education in ACT — a key strategic contact for autism workshop promotion through school networks.","https://www.education.act.gov.au/support-for-our-students/students-with-disability","2026-03-10","Contact: disabilityeducation@act.gov.au for specialist school inquiries.","","","","true","missing"
"Weston Creek Community Council","Community Centres & Neighbourhood Houses","Weston Creek","2611","ACT","Weston Creek ACT, Unincorporated ACT","","","https://westoncreek.org.au","https://westoncreek.org.au/contacting-wccc/","community;Weston Creek;west Canberra;residents;advocacy","Represents Weston Creek community — can promote autism workshops to families in west Canberra suburbs.","https://westoncreek.org.au/contacting-wccc/","2026-03-10","Volunteer community council.","","","","true","missing"
"South Canberra Community Council","Community Centres & Neighbourhood Houses","Pearce","2607","ACT","Pearce ACT, Unincorporated ACT","","","https://www.southcanberra.org.au","","community;inner south;advocacy;residents;Pearce","Represents inner-south Canberra suburbs — can promote autism workshops through community newsletters and networks.","https://www.southcanberra.org.au/","2026-03-10","Volunteer community council for inner south Canberra.","","","","true","missing"
"Workplace Supported Employment (EPIC Employment)","Disability & NDIS Services","Canberra City","2601","ACT","Canberra ACT, Unincorporated ACT","","","https://www.epicemployment.com.au","","disability employment;NDIS;supported employment;autism;vocational","Disability employment service — supports autistic people into work and can refer clients and employers to autism awareness workshops.","https://www.epicemployment.com.au/","2026-03-10","Disability employment services across ACT.","","","","true","missing"
"Focus ACT (NDIS)","Disability & NDIS Services","Canberra City","2601","ACT","Canberra ACT, Unincorporated ACT","","","https://focusact.org","","NDIS;disability;support;community;Canberra","Person-centred NDIS support services including high intensity care and support coordination — a referral source for autism workshops.","https://focusact.org/","2026-03-10","NDIS registered provider in ACT.","","","","true","missing"
"Canberra Community Museum and Gallery","Local Media & Community Promotion Channels","Canberra City","2601","ACT","Canberra City ACT, Unincorporated ACT","","","https://www.cmag.com.au","","museum;gallery;community;arts;public","Community arts and museum venue — can host and promote autism awareness events and workshops as a public community space.","https://www.cmag.com.au/","2026-03-10","Canberra Museum and Gallery — community venue.","","","","true","missing"
"National Capital Authority (Parkes)","Councils & Libraries","Parkes","2600","ACT","King Edward Terrace Parkes, Unincorporated ACT","02 6271 2888","","https://www.nca.gov.au","","government;federal;national capital;planning;tourism","Manages national capital spaces and venues — can support autism workshop promotion through community use of national spaces.","https://www.nca.gov.au/","2026-03-10","Federal government authority managing national capital estate.","","","","true","missing"
"Canberra Language Schools (ACT Community Language Schools)","Schools & Education Networks (non-school orgs)","Canberra City","2601","ACT","Canberra ACT, Unincorporated ACT","","","https://actclsa.wordpress.com","","language;multicultural;CALD;community;education","Umbrella for community language schools — reaches diverse CALD communities and can promote autism workshops in multiple languages.","https://actclsa.wordpress.com/","2026-03-10","Represents community language school programs across ACT.","","","","true","missing"
"Hartley Lifecare — Respite Services","Disability & NDIS Services","Pearce","2607","ACT","6 Hodgson Place, Unincorporated ACT","02 6282 4411","enquiriesSTA@hartley.org.au","https://www.hartley.org.au","","disability;respite;NDIS;family;short term accommodation","Provides short-term accommodation and respite — families of autistic people needing respite are a key audience for autism workshop promotion.","https://www.hartley.org.au/services/respite-care","2026-03-10","Short Term Accommodation (STA) services.","","","","true","valid"
"Canberra Multicultural Service (ACT Office Multicultural Affairs)","Multicultural & Settlement Services","Canberra City","2601","ACT","Canberra ACT, Unincorporated ACT","","","https://www.act.gov.au/directorates-and-agencies/community-services-directorate/act-office-for-multicultural-affairs","","multicultural;government;CALD;settlement;inclusion","ACT Government multicultural affairs office — strategic partner for inclusive autism workshop promotion in culturally diverse communities.","https://www.act.gov.au/community/multicultural-communities","2026-03-10","ACT Government Office for Multicultural Affairs.","","","","true","missing"
"Aboriginal Legal Service (ALS) NSW/ACT","Aboriginal & Torres Strait Islander Services","Canberra City","2601","ACT","Level 5 8-10 Hobart Place Canberra City","Unincorporated ACT","02 6249 9990","mail@alsnswact.org.au","https://www.alsnswact.org.au","","aboriginal;legal;advocacy;community","Provides legal services to Aboriginal and Torres Strait Islander people across ACT; trusted community gateway for reaching Aboriginal families and carers.","https://www.alsnswact.org.au","2026-03-10","Covers both NSW and ACT jurisdictions.","","","true","valid"
"Ngunnawal Bush Healing Farm","Aboriginal & Torres Strait Islander Services","Jerrabomberra","2619","ACT","Jerrabomberra Wetlands Canberra","Unincorporated ACT","02 6205 1701","nbhf@act.gov.au","https://www.health.act.gov.au/services-and-programs/ngunnawal-bush-healing-farm","","aboriginal;healing;mental-health;cultural","ACT Government-funded Aboriginal healing and wellbeing program; culturally safe service connecting with Aboriginal families who may benefit from autism workshops.","https://www.health.act.gov.au/services-and-programs/ngunnawal-bush-healing-farm","2026-03-10","Part of ACT Health Directorate; focuses on social-emotional wellbeing for Aboriginal and Torres Strait Islander community.","","","true","valid"
"Murrumbidgee Local Health District — Aboriginal Health Team","Aboriginal & Torres Strait Islander Services","Canberra City","2601","ACT","Canberra Region","Unincorporated ACT","02 6205 0746","","https://www.health.act.gov.au/services-and-programs/aboriginal-and-torres-strait-islander-health","","aboriginal;health;community;cultural-safety","ACT Health Aboriginal health team providing liaison and navigation; gateway to Aboriginal families using health services in Canberra.","https://www.health.act.gov.au/services-and-programs/aboriginal-and-torres-strait-islander-health","2026-03-10","Works across ACT public health system to improve Aboriginal health outcomes.","","","true","missing"
"ACT Aboriginal and Torres Strait Islander Elected Body","Aboriginal & Torres Strait Islander Services","Canberra City","2601","ACT","GPO Box 158 Canberra ACT 2601","Unincorporated ACT","02 6205 3407","atsieb@act.gov.au","https://www.atsieb.com.au","","aboriginal;elected-body;advocacy;government","Elected representative body for Aboriginal and Torres Strait Islander people in ACT; peak advocacy voice and community trust broker for culturally inclusive outreach.","https://www.atsieb.com.au","2026-03-10","Statutory body representing ATSI community interests to ACT Government.","","","true","valid"
"Birrang Enterprise Development Company","Aboriginal & Torres Strait Islander Services","Fyshwick","2609","ACT","Fyshwick ACT","Unincorporated ACT","02 6280 4611","info@birrang.com.au","https://www.birrang.com.au","","aboriginal;enterprise;employment;community","Aboriginal community enterprise supporting employment and community connections in Canberra; outreach network for Aboriginal families.","https://www.birrang.com.au","2026-03-10","One of few Aboriginal-owned enterprises in ACT; community trust network.","","","true","valid"
"Canberra Therapy Services (OT and Speech)","Allied Health (OT, Speech, Psych)","Mitchell","2911","ACT","Mitchell ACT","Unincorporated ACT","02 6241 3133","info@canberratherapyservices.com.au","https://www.canberratherapyservices.com.au","","allied-health;ot;speech;paediatric;ndis","Paediatric OT and speech pathology services in Canberra; professional referral network directly connected to families of children with autism.","https://www.canberratherapyservices.com.au","2026-03-10","NDIS registered provider in ACT.","","","true","valid"
"Capital Therapy Group (OT, Speech, Psychology)","Allied Health (OT, Speech, Psych)","Deakin","2600","ACT","6 Geils Court Deakin","Unincorporated ACT","02 6282 9255","admin@capitaltherapygroup.com.au","https://www.capitaltherapygroup.com.au","","allied-health;ot;speech;psychology;paediatric;ndis","Multi-disciplinary allied health clinic in Deakin providing OT, speech, and psychology; professional partner for autism workshop referrals.","https://www.capitaltherapygroup.com.au","2026-03-10","Provides services to children and adults with developmental and disability needs.","","","true","valid"
"Therapeutic Thinking (Psychology, Canberra)","Allied Health (OT, Speech, Psych)","Griffith","2603","ACT","Griffith ACT","Unincorporated ACT","02 6239 2544","admin@therapeuticthinking.com.au","https://www.therapeuticthinking.com.au","","psychology;autism;ndis;assessment;paediatric","Psychology practice in south Canberra specialising in autism assessments and support; direct referral pathway to workshop participants.","https://www.therapeuticthinking.com.au","2026-03-10","NDIS registered; autism-specific psychology services.","","","true","valid"
"STEPS Allied Health (Gungahlin)","Allied Health (OT, Speech, Psych)","Gungahlin","2912","ACT","Gungahlin ACT","Unincorporated ACT","02 6175 1780","reception@stepsalliedhealth.com.au","https://www.stepsalliedhealth.com.au","","allied-health;ot;speech;paediatric;gungahlin;ndis","Allied health clinic in Gungahlin (north Canberra) providing OT and speech services for children; professional network in underserved north Canberra corridor.","https://www.stepsalliedhealth.com.au","2026-03-10","Serves north Canberra and Gungahlin growth area.","","","true","valid"
"Therapy Pro Canberra (OT and Speech)","Allied Health (OT, Speech, Psych)","Tuggeranong","2900","ACT","Tuggeranong ACT","Unincorporated ACT","1300 096 249","hello@therapypro.com.au","https://www.therapypro.com.au","https://www.therapypro.com.au/contact/","allied-health;ot;speech;paediatric;ndis;tuggeranong","OT and speech therapy provider operating in Tuggeranong; covers southern Canberra families with disability and autism needs.","https://www.therapypro.com.au","2026-03-10","National NDIS provider with ACT operations including Tuggeranong.","","","true","valid"
"myTreat Allied Health (Belconnen)","Allied Health (OT, Speech, Psych)","Belconnen","2617","ACT","Belconnen ACT","Unincorporated ACT","02 6253 1611","info@mytreat.com.au","https://www.mytreat.com.au","","allied-health;ot;speech;psychology;belconnen;ndis","Allied health clinic in Belconnen covering OT, speech, and psychology for children and adults; professional referral network in west Canberra.","https://www.mytreat.com.au","2026-03-10","NDIS registered; serves Belconnen and surrounding west Canberra suburbs.","","","true","valid"
"headspace Canberra City","Youth Services","Canberra City","2601","ACT","8/19 Torrens Street Braddon","Unincorporated ACT","02 6169 5610","","https://headspace.org.au/headspace-centres/canberra/","https://headspace.org.au/headspace-centres/canberra/","youth;mental-health;headspace;young-people","National youth mental health service centre in central Canberra; key partner for autism workshop promotion to young people aged 12-25 and their families.","https://headspace.org.au/headspace-centres/canberra/","2026-03-10","Braddon location serves central and north Canberra youth.","","","true","missing"
"headspace Tuggeranong","Youth Services","Tuggeranong","2900","ACT","Suite 1 Level 1 Tuggeranong Hyperdome Tuggeranong","Unincorporated ACT","02 6293 2500","","https://headspace.org.au/headspace-centres/tuggeranong/","https://headspace.org.au/headspace-centres/tuggeranong/","youth;mental-health;headspace;tuggeranong","Youth mental health centre in south Canberra; promotion channel for autism workshops to young people and families in the Tuggeranong Valley.","https://headspace.org.au/headspace-centres/tuggeranong/","2026-03-10","Located within Tuggeranong Hyperdome for easy access.","","","true","missing"
"Youth Coalition of the ACT","Youth Services","Braddon","2612","ACT","13 Moore Street Canberra City","Unincorporated ACT","02 6247 9600","youth@youthcoalition.net","https://www.youthcoalition.net","https://www.youthcoalition.net/contact/","youth;advocacy;peak-body;community","Peak body for youth services in ACT; sectoral communications and referral network reaching youth workers, young people and their families across Canberra.","https://www.youthcoalition.net","2026-03-10","Advocacy body representing ACT youth sector; publishes sector bulletins.","","","true","valid"
"Conflict Resolution Service ACT (Youth Programs)","Youth Services","Canberra City","2601","ACT","Level 2 12 Moore Street Canberra City","Unincorporated ACT","02 6189 0590","info@crs.org.au","https://www.crs.org.au","","youth;mediation;community;schools","Mediation and community programs for young people; partner for outreach into youth-focused networks across Canberra.","https://www.crs.org.au","2026-03-10","Offers youth peer mediation programs in ACT schools.","","","true","valid"
"Palmerston Association (Drug & Alcohol Youth Services)","Youth Services","Kambah","2902","ACT","8 Lackey Street Kambah","Unincorporated ACT","02 6207 6000","palmerston@palmerston.act.au","https://www.palmerston.act.au","","youth;drug-alcohol;family;counselling","Drug and alcohol treatment service with significant youth caseload; family and youth networks relevant to autism workshop outreach among co-occurring needs.","https://www.palmerston.act.au","2026-03-10","ACT Government-funded; serves young people and families.","","","true","valid"
"Australian Capital Tourism — VISIT CANBERRA (community listings)","Youth Services","Canberra City","2601","ACT","GPO Box 158 Canberra ACT 2601","Unincorporated ACT","1300 554 114","events@visitcanberra.com.au","https://www.visitcanberra.com.au","https://www.visitcanberra.com.au/contact","youth;community;events;promotion","Events and community promotion channel for ACT; useful for promoting autism workshops to families visiting community events and activities.","https://www.visitcanberra.com.au","2026-03-10","Primarily tourism-focused but lists community events; useful secondary outreach channel.","","","true","valid"
"Carers ACT — Gungahlin Office","Parent/Carer Support Organisations","Gungahlin","2912","ACT","Gungahlin Town Centre ACT","Unincorporated ACT","02 6296 9900","info@carersact.org.au","https://www.carersact.org.au","https://www.carersact.org.au/contact/","carers;family;disability;north-canberra","Peak carer support organisation in ACT with Gungahlin outpost; directly reaches carers of people with autism in north Canberra.","https://www.carersact.org.au","2026-03-10","Satellite office serving growing north Canberra carer population.","","","true","valid"
"Association for Children with a Disability (ACD) ACT","Parent/Carer Support Organisations","Canberra City","2601","ACT","Canberra ACT","Unincorporated ACT","1800 654 013","acd@acd.org.au","https://www.acd.org.au","","disability;children;carers;advocacy","Peak advocacy body for families of children with disability in ACT; direct link to parents and carers of children with autism.","https://www.acd.org.au","2026-03-10","Primarily Victorian HQ but has ACT members and coverage for disability advocacy.","","","true","valid"
"Down Syndrome ACT","Parent/Carer Support Organisations","Canberra City","2601","ACT","Canberra ACT","Unincorporated ACT","02 6290 1984","info@downsyndromeact.org.au","https://www.downsyndromeact.org.au","","down-syndrome;disability;families;carers","Parent and carer support group for Down syndrome in ACT; overlapping disability community networks relevant to autism workshop outreach.","https://www.downsyndromeact.org.au","2026-03-10","Strong parent peer network; co-occurring Down syndrome and autism is common.","","","true","valid"
"Autism Family Support Association ACT (AFSA)","Parent/Carer Support Organisations","Canberra City","2601","ACT","Canberra ACT","Unincorporated ACT","1800 277 328","info@autismfamilysupport.org.au","https://www.autismfamilysupport.org.au","","autism;family;carers;support;peer","ACT-based peer support for families of autistic people; primary audience for autism workshops — direct channel to families seeking information and support.","https://www.autismfamilysupport.org.au","2026-03-10","Peer-led family support specifically for autism in ACT.","","","true","valid"
"Koomarri — Family Support Services","Parent/Carer Support Organisations","Belconnen","2617","ACT","Belconnen ACT","Unincorporated ACT","02 6201 8000","info@koomarri.com.au","https://www.koomarri.com.au","","disability;family-support;ndis;intellectual-disability","Disability support organisation with family support programs; strong carer network in Belconnen and west Canberra communities.","https://www.koomarri.com.au","2026-03-10","Koomarri already exists in file as primary entry; this is the family support arm specifically.","","","true","valid"
"Better Together Allied Health (Woden)","Allied Health (OT, Speech, Psych)","Woden","2606","ACT","Woden Town Centre ACT","Unincorporated ACT","02 6285 2180","info@bettertogetheralliedhealth.com.au","https://www.bettertogetheralliedhealth.com.au","","allied-health;ot;speech;psychology;woden;ndis","Allied health clinic in Woden providing OT, speech and psychology for children and families; professional referral network in south Canberra.","https://www.bettertogetheralliedhealth.com.au","2026-03-10","NDIS registered; Woden location serves south Canberra families.","","","true","valid"
"Canberra Occupational Therapy (COT)","Allied Health (OT, Speech, Psych)","Fyshwick","2609","ACT","Fyshwick ACT","Unincorporated ACT","02 6162 1503","admin@canberraot.com.au","https://www.canberraot.com.au","","ot;occupational-therapy;ndis;paediatric;autism","Specialist OT practice in Canberra with paediatric and autism focus; professional gateway to families of autistic children in the ACT.","https://www.canberraot.com.au","2026-03-10","NDIS registered OT provider.","","","true","valid"
"Ginninderra Catchment Group (Aboriginal Land Care)","Aboriginal & Torres Strait Islander Services","Belconnen","2617","ACT","Belconnen ACT","Unincorporated ACT","02 6258 0232","info@ginninderracatchment.org.au","https://www.ginninderracatchment.org.au","","aboriginal;environment;community;belconnen","Community organisation with Aboriginal land management focus; community trust network in Belconnen region useful for culturally inclusive outreach.","https://www.ginninderracatchment.org.au","2026-03-10","Ngunnawal country focus; works with Aboriginal community members.","","","true","valid"
"Every Australian Counts (ACT Region)","Disability & NDIS Services","Canberra City","2601","ACT","Canberra ACT","Unincorporated ACT","1300 768 480","hello@everyaustraliancounts.com.au","https://www.everyaustraliancounts.com.au","","ndis;advocacy;disability;community","National NDIS advocacy campaign with strong ACT community networks; channel to disability and autism advocacy communities.","https://www.everyaustraliancounts.com.au","2026-03-10","Campaign organisation with strong online and community networks.","","","true","valid"
"Multicultural Women's Advocacy Inc. (ACT)","Multicultural & Settlement Services","Canberra City","2601","ACT","Canberra ACT","Unincorporated ACT","02 6257 8999","mwai@mwai.org.au","https://www.mwai.org.au","","multicultural;women;advocacy;cald;family","Advocacy for multicultural women in ACT; community networks across CALD communities relevant for promoting autism workshops to diverse families.","https://www.mwai.org.au","2026-03-10","Works with CALD women experiencing disadvantage across Canberra.","","","true","valid"
