"organisation_name","category","suburb","postcode","state","address_line","lga","phone","public_email","website_url","contact_form_url","tags","workshop_relevance","source_url","last_verified","notes","lat","lon","website_checked","email_quality"
"Special Olympics ACT (Greater Canberra)","Sport, Recreation & Inclusion Programs","Belconnen","2617","ACT","42 Oatley Court, Unincorporated ACT","","act.membership@specialolympics.com.au","https://www.specialolympics.com.au","","disability sport;intellectual disability;inclusion;community;sport","Provides inclusive sport for people with intellectual disabilities — relevant for reaching families of autistic people through sport participation networks.","https://www.specialolympics.com.au/find-a-sport-near-me/act","2026-03-10","Basketball at 42 Oatley Court Belconnen and swimming at various venues.","","","","true","valid"
"Volunteering and Contact ACT","Community Centres & Neighbourhood Houses","Canberra City","2601","ACT","Level 2 202 City Walk (Griffin Centre 20 Genge Street), Unincorporated ACT","02 6251 4060","info@vc-act.org.au","https://volunteeringact.org.au","https://vc-act.org.au/contact-us/","volunteering;community;information;civic;peak body","Connects volunteers and community organisations — a key multiplier for autism workshop promotion through the ACT volunteer network.","https://vc-act.org.au/contact-us/","2026-03-10","Also provides community information and referral services.","","","","true","valid"
"Canberra Community Law","NGOs/Charities (family, disability, mental health)","Canberra City","2601","ACT","GPO Box 547 Canberra City, Unincorporated ACT","02 6218 7900","info@canberracommunitylaw.org.au","https://canberracommunitylaw.org.au","https://canberracommunitylaw.org.au/contact-us/","legal;disability;community;advocacy;welfare","Community legal centre with disability law expertise — can promote autism workshops to clients navigating NDIS and disability rights.","https://canberracommunitylaw.org.au/contact-us/","2026-03-10","Provides free legal services to disadvantaged Canberrans.","","","","true","valid"
"Karinya House","Early Childhood & Family Services","Kaleen","2617","ACT","PO Box 7239 Kaleen, Unincorporated ACT","02 6259 8998","","https://karinyahouse.asn.au","https://karinyahouse.asn.au/contact-us/","mothers;babies;family;crisis;women","Supports mothers and babies in crisis — can help promote autism workshops to vulnerable families with young children.","https://karinyahouse.asn.au/contact-us/","2026-03-10","24-hour contact line. Women and babies support charity.","","","","true","missing"
"Beryl Women Inc.","NGOs/Charities (family, disability, mental health)","Dickson","2602","ACT","PO Box 355 Dickson, Unincorporated ACT","02 6230 6900","admin@beryl.org.au","https://www.beryl.org.au","https://www.beryl.org.au/contacts/","women;DFV;crisis;accommodation;family","Crisis accommodation for women and children — a contact point for families in need who may include autistic children.","https://www.beryl.org.au/contacts/","2026-03-10","Provides crisis accommodation for women escaping domestic violence.","","","","true","valid"
"666 ABC Radio Canberra","Local Media & Community Promotion Channels","Dickson","2602","ACT","Corner Northbourne and Wakefield Avenues, Unincorporated ACT","02 6275 4555","","https://www.abc.net.au/listen/radio/canberra","","media;radio;community;promotion;ABC","ABC local radio station with strong Canberra community following — a valuable promotional channel for autism workshops and awareness campaigns.","https://www.abc.net.au/listen/radio/canberra","2026-03-10","Talkback: 1300 681 666. Text: 0467 922 666.","","","","true","missing"
"The Canberra Times","Local Media & Community Promotion Channels","Canberra City","2601","ACT","Level 1 121 Marcus Clarke Street, Unincorporated ACT","02 6280 2122","media.release@canberratimes.com.au","https://www.canberratimes.com.au","https://www.canberratimes.com.au/news/send-us-your-news/","media;newspaper;print;online;community","Major Canberra newspaper with local news reach — submit press releases for autism workshop promotion to community and feature editors.","https://www.canberratimes.com.au/contact/","2026-03-10","Accepts community press releases via media.release@canberratimes.com.au.","","","","true","valid"
"Region Canberra (region.com.au)","Local Media & Community Promotion Channels","Forrest","2603","ACT","Suite 1.4 28 National Circuit Forrest, Unincorporated ACT","","editor@region.com.au","https://region.com.au","https://region.com.au/contact/","media;online news;community;digital;Canberra","Free community news outlet widely read in Canberra — an accessible and free promotional channel for autism workshops and awareness events.","https://region.com.au/contact/","2026-03-10","Community news organisation. No paywall. Accepts community stories and events.","","","","true","valid"
"Canberra Multicultural Community Forum (CMCF)","Multicultural & Settlement Services","Canberra City","2601","ACT","Canberra City, Unincorporated ACT","","","https://cmcf.org.au","","multicultural;peak body;CALD;community;settlement","ACT peak body representing 112 multicultural community organisations — key strategic partner for reaching CALD communities about autism workshops.","https://cmcf.org.au/","2026-03-10","Represents multicultural community organisations across ACT.","","","","true","missing"
"ACT Government — Access Canberra (Civic)","Councils & Libraries","Canberra City","2601","ACT","300 Macquarie Street Civic, Unincorporated ACT","13 22 81","","https://www.accesscanberra.act.gov.au","","government;community;services;information","ACT Government service centre — high-traffic public venue for community information and autism workshop promotion displays.","https://www.accesscanberra.act.gov.au","2026-03-10","Government services including licences and community information.","","","","true","missing"
"ACT Government — Access Canberra (Gungahlin)","Councils & Libraries","Gungahlin","2912","ACT","5 Fussell Lane, Unincorporated ACT","13 22 81","","https://www.accesscanberra.act.gov.au","","government;community;services;information;Gungahlin","Government service centre in growing north Canberra suburb — prominent location for community autism workshop flyers.","https://www.accesscanberra.act.gov.au/contact-us/gungahlin","2026-03-10","Government services including licences and community information.","","","","true","missing"
"ACT Government — Access Canberra (Tuggeranong)","Councils & Libraries","Greenway","2900","ACT","Cowlishaw Street Tuggeranong, Unincorporated ACT","13 22 81","","https://www.accesscanberra.act.gov.au","","government;community;services;Tuggeranong;information","Government service centre for south Canberra — useful distribution point for autism workshop promotional materials.","https://www.accesscanberra.act.gov.au/contact-us/tuggeranong","2026-03-10","Government services including licences and community information.","","","","true","missing"
"ACT Government — Access Canberra (Belconnen)","Councils & Libraries","Belconnen","2617","ACT","Belconnen Town Centre, Unincorporated ACT","13 22 81","","https://www.accesscanberra.act.gov.au","","government;community;services;Belconnen;information","High-traffic government service centre in Belconnen — good venue for autism workshop promotion materials.","https://www.accesscanberra.act.gov.au/contact-us/belconnen","2026-03-10","Government services including licences and community information.","","","","true","missing"
"Canberra Health Services — Community Health","Health Services & Primary Health Networks","Garran","2605","ACT","Yamba Drive Garran, Unincorporated ACT","02 5124 9977","","https://www.canberrahealthservices.act.gov.au","","health;community health;allied health;therapy;public health","Government community health services — an important referral pathway for families of autistic people to workshop information and support services.","https://www.canberrahealthservices.act.gov.au/contact-us","2026-03-10","Mental health support line: 1800 629 354 (24/7).","","","","true","missing"
"Gungahlin Community Health Centre","Health Services & Primary Health Networks","Gungahlin","2912","ACT","1 Mustang Ave Gungahlin, Unincorporated ACT","02 6207 9977","","https://www.canberrahealthservices.act.gov.au/locations-and-directions/gungahlin-community-health-centre","","health;community;Gungahlin;allied health;north Canberra","Community health facility in Gungahlin — a key contact point for autism workshop promotion in the rapidly growing north.","","2026-03-10","Part of Canberra Health Services network.","","","","true","missing"
"Centenary Hospital for Women and Children","Health Services & Primary Health Networks","Garran","2605","ACT","Building 11 Yamba Drive, Unincorporated ACT","02 6207 9977","","https://www.canberrahealthservices.act.gov.au/locations-and-directions/centenary-hospital-for-women-and-children","","women;children;maternity;paediatric;health","Key paediatric hospital — staff support families with young autistic children and can share workshop information at point of diagnosis.","https://www.canberrahealthservices.act.gov.au/locations-and-directions/centenary-hospital-for-women-and-children","2026-03-10","Part of Canberra Health Services network.","","","","true","missing"
"Canberra Rape Crisis Centre","NGOs/Charities (family, disability, mental health)","Canberra City","2601","ACT","Canberra City (address confidential), Unincorporated ACT","02 6247 2525","crcc@crcc.org.au","https://crcc.org.au","https://crcc.org.au/contact-us/","women;sexual violence;trauma;crisis;counselling","Supports survivors of sexual violence — relevant for autism workshops covering safety and relationships for autistic people.","https://crcc.org.au/contact-us/","2026-03-10","Crisis line 7am–11pm daily. Physical address confidential.","","","","true","valid"
"Islamic School of Canberra","Faith-Based Community Organisations","Weston","2611","ACT","33 Heysen Street, Unincorporated ACT","","","https://www.islamicschoolofcanberra.act.edu.au","","faith;Islamic;Muslim;school;multicultural","Faith-based school serving Muslim families in Canberra — a channel for autism workshop promotion in the Muslim community.","https://www.islamicschoolofcanberra.act.edu.au/","2026-03-10","Co-educational independent school Kindy to Year 10.","","","","true","missing"
"Meridian ACT","Health Services & Primary Health Networks","Canberra City","2601","ACT","Canberra City, Unincorporated ACT","","","https://www.meridianact.org.au","","LGBTIQA+;health;wellbeing;community;counselling","Peer-led LGBTIQA+ health organisation — important for autism workshop promotion given elevated autism prevalence in LGBTIQA+ communities.","https://www.meridianact.org.au/","2026-03-10","Provides sexual health; HIV; counselling; and community connection services.","","","","true","missing"
"Canberra Southern Cross Club","Sport, Recreation & Inclusion Programs","Woden","2606","ACT","92-96 Corinna Street, Unincorporated ACT","02 6283 7200","events@cscc.com.au","https://www.cscc.com.au","https://www.cscc.com.au/contact/","club;recreation;community;sport;venue","Major community club network with social programs — a potential venue partner for autism workshop events in south Canberra.","https://www.cscc.com.au/contact/","2026-03-10","Not-for-profit club with Woden; Jamison; Tuggeranong and Yacht Club venues.","","","","true","valid"
"Gungahlin Community Council","Community Centres & Neighbourhood Houses","Gungahlin","2912","ACT","Gungahlin, Unincorporated ACT","","","https://gcc.asn.au","https://gcc.asn.au/contact/","community council;Gungahlin;north Canberra;advocacy;residents","Voice for north Canberra community — can promote autism workshops to fast-growing Gungahlin suburb families.","https://gcc.asn.au/contact/","2026-03-10","Volunteer community organisation advocating for Gungahlin residents.","","","","true","missing"
"Tuggeranong Community Council","Community Centres & Neighbourhood Houses","Greenway","2900","ACT","PO Box 436 Erindale Centre, Unincorporated ACT","","info@tuggeranong.org.au","https://www.tuggeranong.org.au","","community;Tuggeranong;south Canberra;advocacy;residents","Represents south Canberra communities — can help promote autism workshops and events in Tuggeranong districts.","https://www.tuggeranong.org.au/","2026-03-10","Volunteer community organisation.","","","","true","valid"
"Belconnen Community Council","Community Centres & Neighbourhood Houses","Belconnen","2617","ACT","PO Box 1131 Belconnen, Unincorporated ACT","0438 458 220","hello@belcouncil.org.au","https://belconnen.org.au","https://belconnen.org.au/contact-us/","community;Belconnen;north west Canberra;advocacy","Volunteer community organisation for Belconnen district — can promote autism workshops across the Belconnen area.","https://belconnen.org.au/contact-us/","2026-03-10","Voluntary community group — not a government council.","","","","true","valid"
"Cranleigh School (Specialist)","Schools & Education Networks (non-school orgs)","Lyneham","2602","ACT","Cnr Lyneham Drive & Brierly Street, Unincorporated ACT","02 6142 0444","info@cranleighps.act.edu.au","https://www.cranleighps.act.edu.au","","specialist school;autism;disability;education;Preschool-Year6","Specialist school for students with significant intellectual disabilities and autism in north Canberra — a direct link to families of autistic children.","https://www.cranleighps.act.edu.au/","2026-03-10","Serves students preschool to Year 6 living north of Lake Burley Griffin.","","","","true","valid"
"Namadgi School","Schools & Education Networks (non-school orgs)","Kambah","2902","ACT","141 O'Halloran Circuit, Unincorporated ACT","02 6142 0900","","https://www.namadgi.act.edu.au","https://www.namadgi.act.edu.au/contact_us","school;disability;Kambah;Tuggeranong;inclusion","Public school in south Canberra with disability support program — useful contact for autism workshop promotion to families in that area.","https://www.namadgi.act.edu.au/contact_us","2026-03-10","P-10 school with disability support program.","","","","true","missing"
"Malkara Specialist School","Schools & Education Networks (non-school orgs)","Holt","2615","ACT","Oaks Estate Holt, Unincorporated ACT","","","https://www.malkara.act.edu.au","","specialist school;autism;disability;southside;Preschool-Year6","ACT specialist school for students with intellectual disability and autism south of the lake — key contact for south Canberra families.","https://www.education.act.gov.au/support-for-our-students/students-with-disability/specialist-schools","2026-03-10","Specialist school preschool to year 6 in southside.","","","","true","missing"
"The Woden School (Specialist)","Schools & Education Networks (non-school orgs)","Garran","2605","ACT","Yamba Drive Garran, Unincorporated ACT","","","https://www.woden.act.edu.au","","specialist school;autism;disability;secondary;southside","Specialist secondary school for students with intellectual disability south of the lake — important for families with autistic teenagers.","https://www.education.act.gov.au/support-for-our-students/students-with-disability/specialist-schools","2026-03-10","Serves years 7-12 southside.","","","","true","missing"
"Black Mountain School (Specialist)","Schools & Education Networks (non-school orgs)","Acton","2601","ACT","Kingsley Street Acton, Unincorporated ACT","","","https://www.blackmountain.act.edu.au","","specialist school;autism;disability;secondary;northside","Specialist secondary school for north Canberra students with intellectual disability — key contact for north Canberra autism workshop referrals.","https://www.education.act.gov.au/support-for-our-students/students-with-disability/specialist-schools","2026-03-10","Serves years 7-12 northside.","","","","true","missing"
"Marymead CatholicCare — Autism Connect Service","Allied Health (OT, Speech, Psych)","Braddon","2612","ACT","51 Cooyong Street, Unincorporated ACT","1300 308 699","autismconnect@mccg.org.au","https://mccg.org.au/services/autism-connect/","","autism;helpline;information;referral;ACT","Delivers national Autism Connect helpline locally — primary referral service for autism information and workshop signposting in the ACT.","https://mccg.org.au/services/autism-connect/","2026-03-10","Free service 8am-7pm Mon-Fri. Partnership with Amaze national autism helpline.","","","","true","valid"
"Connect2Care (NDIS Allied Health)","Allied Health (OT, Speech, Psych)","Griffith","2603","ACT","Manuka (Griffith area), Unincorporated ACT","","","https://connect2care.com.au/locations/ndis-providers-act-canberra/","","OT;speech pathology;allied health;NDIS;therapy","NDIS allied health provider with practice hub in Manuka — can promote autism workshops to clients receiving OT and speech pathology.","https://connect2care.com.au/locations/ndis-providers-act-canberra/","2026-03-10","Registered NDIS provider offering mobile services across ACT.","","","","true","missing"
"Ability Action Australia (ACT)","Allied Health (OT, Speech, Psych)","Canberra City","2601","ACT","Canberra ACT, Unincorporated ACT","1800 238 958","hello@abilityactionaustralia.com.au","https://abilityactionaustralia.com.au","","OT;speech pathology;psychology;NDIS;allied health","Registered NDIS therapy provider in ACT — relevant for autism workshop promotion to clients receiving early intervention and therapeutic supports.","https://abilityactionaustralia.com.au/our-offices/act/","2026-03-10","Provides OT; speech pathology; psychology and behaviour support across full ACT.","","","","true","valid"
"Canberra Community Music (FM100.3)","Local Media & Community Promotion Channels","Belconnen","2617","ACT","Belconnen ACT, Unincorporated ACT","","","https://www.2xx.org.au","","radio;community;promotion;Canberra;media","Community radio station — a free promotional channel for autism workshop events and community awareness campaigns.","https://www.2xx.org.au/","2026-03-10","2XX 98.3FM community radio station Canberra.","","","","true","missing"
"Communities@Work — Weston Creek Hub","Community Centres & Neighbourhood Houses","Weston Creek","2611","ACT","Weston Creek ACT, Unincorporated ACT","02 6293 6500","marketing@commsatwork.org","https://www.commsatwork.org","","community;Weston Creek;family;support;west Canberra","Communities@Work Weston Creek hub — serves families in west Canberra and can promote autism workshops to local community members.","https://www.commsatwork.org/","2026-03-10","Part of Communities@Work network.","","","","true","valid"
"Aspect Australia — ACT Region","Disability & NDIS Services","Canberra City","2601","ACT","Canberra ACT, Unincorporated ACT","","","https://www.aspect.org.au","https://www.aspect.org.au/contact-us","autism;NDIS;disability;schools;specialist","National autism service with ACT presence — strategic partner for autism workshop promotion and referrals.","https://www.aspect.org.au/contact-us","2026-03-10","Contact national office for ACT services via website. Runs specialist autism schools and programs.","","","","true","missing"
"ACT Down Syndrome & Intellectual Disability Association — DADI","NGOs/Charities (family, disability, mental health)","Pearce","2607","ACT","Building 2 Level 1 Pearce Community Centre, Unincorporated ACT","02 6290 0656","admin@actdsa.org.au","https://www.downsyndrome.org.au/act","","intellectual disability;Down syndrome;family;advocacy;community","Supports families of people with intellectual disabilities — overlapping networks with autism community for workshop promotion.","https://www.downsyndrome.org.au/act/","2026-03-10","Also known as ACTDSA.","","","","true","valid"
"People With Disabilities ACT (PWD ACT)","Disability & NDIS Services","Canberra City","2601","ACT","Canberra ACT, Unincorporated ACT","","","https://pwdact.org.au","","disability;advocacy;peak body;sport;community","Peak disability advocacy organisation in ACT — a key partner for autism workshop promotion through the disability community.","https://pwdact.org.au/","2026-03-10","Runs the Canberra PWDACT Sporting Network.","","","","true","missing"
"Northcott (Canberra)","Disability & NDIS Services","Canberra City","2601","ACT","Canberra ACT, Unincorporated ACT","1800 818 286","","https://northcott.com.au/locations/northcott-canberra/","","NDIS;disability;support coordination;therapy;community","NDIS disability service provider with Canberra office — can promote autism workshops through their support coordination clients.","https://northcott.com.au/locations/northcott-canberra/","2026-03-10","On-site parking available. Walk-ins welcome.","","","","true","missing"
"Canberra Alliance for Participatory Democracy (CAPaD)","Community Centres & Neighbourhood Houses","Canberra City","2601","ACT","Canberra City ACT, Unincorporated ACT","","","https://canberra-alliance.org.au","","community;democracy;civic;advocacy;public","Community civic organisation — can support autism workshop promotion through community engagement networks.","https://canberra-alliance.org.au/","2026-03-10","Volunteer community organisation promoting civic engagement.","","","","true","missing"
"North Canberra Community Council","Community Centres & Neighbourhood Houses","Dickson","2602","ACT","Dickson ACT, Unincorporated ACT","","","https://www.northcanberra.org.au","","community;inner north;Dickson;advocacy;residents","Represents inner-north Canberra communities — a useful promotion channel for autism workshops in inner north suburbs.","https://www.northcanberra.org.au/","2026-03-10","Volunteer community council representing inner north Canberra.","","","","true","missing"
"Menslink ACT (Holder)","Youth Services","Holder","2611","ACT","Holder ACT, Unincorporated ACT","02 6239 4699","","https://menslink.org.au","","youth;young men;mental health;mentoring;Holder","Mentoring and counselling for young men 10-25 — important for autism workshop promotion to young autistic males and their families.","https://menslink.org.au/","2026-03-10","Also runs workplace mental health programs.","","","","true","missing"
"ACT Human Rights Commission — Disability Services","Disability & NDIS Services","Canberra City","2601","ACT","Canberra City ACT, Unincorporated ACT","02 6205 2222","","https://www.hrc.act.gov.au","","human rights;disability;complaints;advocacy;government","Independent statutory body protecting human rights — relevant for promoting autism workshops about rights and advocacy.","https://www.hrc.act.gov.au/disability/disability-services","2026-03-10","Handles complaints about disability services and discrimination in ACT.","","","","true","missing"
"Canberra Jewish Community Council","Faith-Based Community Organisations","Canberra City","2601","ACT","Canberra ACT, Unincorporated ACT","","","https://www.jewishcanberra.com","","faith;Jewish;multicultural;community;inclusion","Represents the Canberra Jewish community — can promote autism workshops to Jewish families and networks.","https://www.jewishcanberra.com/","2026-03-10","Representative body for Canberra's Jewish community.","","","","true","missing"
"Canberra Deaf Club","Disability & NDIS Services","Canberra City","2601","ACT","Canberra ACT, Unincorporated ACT","","","https://www.canberradeafclub.org.au","","deaf;hearing impaired;community;social;inclusion","Social club for deaf and hard of hearing people — relevant for inclusive autism workshops accessible to deaf-autistic participants.","https://www.canberradeafclub.org.au/","2026-03-10","Community social organisation.","","","","true","missing"
"Sexual Health & Family Planning ACT (SHFPACT)","Health Services & Primary Health Networks","Canberra City","2601","ACT","Canberra ACT, Unincorporated ACT","","","https://www.shfpact.org.au","","sexual health;family planning;health;women;community","Provides sexual health education — important for autism workshops covering relationships and sexual health education for autistic people.","https://www.shfpact.org.au/","2026-03-10","Health promotion and education services.","","","","true","missing"
"Beryl Women Inc. — Tuggeranong","NGOs/Charities (family, disability, mental health)","Dickson","2602","ACT","PO Box 355 Dickson, Unincorporated ACT","02 6230 6900","admin@beryl.org.au","https://www.beryl.org.au","","women;crisis;DFV;family;support","Crisis accommodation and support services for women and children — autism workshops on safety and family matters are relevant to their clients.","https://www.beryl.org.au/contacts/","2026-03-10","Same contact as main Beryl Women Inc. entry.","","","","true","valid"
"Healthdirect Australia (ACT helpline)","Health Services & Primary Health Networks","Canberra City","2601","ACT","ACT, Unincorporated ACT","1800 022 222","","https://www.healthdirect.gov.au","","health;phone advice;24 hour;telehealth;referral","National health information line widely used in ACT — a channel for directing people to autism support services and workshops.","https://www.healthdirect.gov.au/","2026-03-10","24-hour nurse-on-call service. Also provides online health services directory.","","","","true","missing"
"Canberra YMCA — Chifley Health & Fitness","Sport, Recreation & Inclusion Programs","Chifley","2606","ACT","Unit 9 71 Maclaurin Crescent, Unincorporated ACT","02 6281 0124","","https://ymcacanberra.org.au","","YMCA;fitness;health;community;inclusion","Community fitness and recreation centre — can promote autism workshops and provides inclusive programming for people with disabilities.","https://ymcacanberra.org.au/","2026-03-10","Part of YMCA Canberra network.","","","","true","missing"
