"organisation_name","category","suburb","postcode","state","address_line","lga","phone","public_email","website_url","contact_form_url","tags","workshop_relevance","source_url","last_verified","notes","lat","lon","website_checked","email_quality"
"Multicultural Neighbourhood Centre","Multicultural & Settlement Services","Lambton","2299","NSW","3 Illalung Road, Lambton NSW 2299","Newcastle","02 4965 5291","info@mncinc.org.au","https://www.mncinc.org.au/","https://www.mncinc.org.au/contact/","multicultural,settlement,newcastle","Established multicultural support organisation with strong Newcastle-area community connections.","https://www.mncinc.org.au/contact/","2026-03-09","Used official contact page organisation markup for address and email.","","","true","valid"
"Port Stephens Family and Neighbourhood Services (Child & Family Team)","Early Childhood & Family Services","Raymond Terrace","2324","NSW","3-5 Phillip Street, Raymond Terrace NSW 2324","Port Stephens","02 49 800 800","caf@psfans.org.au","https://psfans.org.au/","https://psfans.org.au/portfolio-item/child-family-counselling-casework/","family-services,parenting,port-stephens","Local family support organisation with direct child, parent and program networks across Port Stephens.","https://psfans.org.au/portfolio-item/child-family-counselling-casework/","2026-03-09","Used the official child and family counselling page for current team email and Raymond Terrace location.","","","true","valid"
"Port Stephens Family and Neighbourhood Services (Youth & Family Team)","Youth Services","Raymond Terrace","2324","NSW","3-5 Phillip Street, Raymond Terrace NSW 2324","Port Stephens","02 49 800 800","yaf@psfans.org.au","https://psfans.org.au/","https://psfans.org.au/portfolio-item/youth-counselling-and-casework/","youth,family,port-stephens","Youth-focused local service with school and family links that can support workshop promotion and referrals.","https://psfans.org.au/portfolio-item/youth-counselling-and-casework/","2026-03-09","Used the official youth counselling and casework page for current program email and Raymond Terrace location.","","","true","valid"
"Cessnock City Library","Councils & Libraries","Cessnock","2325","NSW","65-67 Vincent Street, Cessnock NSW 2325","Cessnock","(02) 4993 4399","library@cessnock.nsw.gov.au","https://www.cessnock.nsw.gov.au/libraries/Home","https://www.cessnock.nsw.gov.au/libraries/About-us/Visit-a-branch","library,council,cessnock","Regional library service with strong local event and noticeboard reach across the Cessnock area.","https://www.cessnock.nsw.gov.au/libraries/About-us/Visit-a-branch","2026-03-09","Used official branch page for Cessnock address, phone and public library email.","","","true","valid"
"Cessnock Family Support Service","Early Childhood & Family Services","Cessnock","2325","NSW","5 Hall Street, Cessnock NSW 2325","Cessnock","(02) 4990 4507","","https://cfss.ngo.org.au/","https://cfss.ngo.org.au/contact-us/","family-services,parenting,cessnock","Local parenting and family support service with direct relevance to workshop referrals and promotion.","https://cfss.ngo.org.au/contact-us/","2026-03-09","Official contact page exposed address and phone; the site uses a contact form and did not clearly publish a general email address.","","","true","missing"
"Singleton Public Library","Councils & Libraries","Singleton","2330","NSW","8-10 Queen Street, Singleton NSW 2330","Singleton","(02) 6578 7500","library@singleton.nsw.gov.au","https://library.singleton.nsw.gov.au/","https://library.singleton.nsw.gov.au/Montage/Default.aspx","library,council,singleton","Regional library with broad family-facing programs and trusted local communication channels.","https://library.singleton.nsw.gov.au/Montage/Default.aspx","2026-03-09","Used official library catalogue landing page for public phone, email and location.","","","true","valid"
"Singleton Youth Venue","Youth Services","Singleton","2330","NSW","Cnr Pitt and Bathurst Street, Singleton NSW 2330","Singleton","02 6578 7501","youthvenue@singleton.nsw.gov.au","https://www.singleton.nsw.gov.au/","https://www.singleton.nsw.gov.au/Live/Residents/Youth-Venue/About-the-Youth-Venue","youth,family,singleton","Council youth venue with direct access to local young people and family support pathways.","https://www.singleton.nsw.gov.au/Live/Residents/Youth-Venue/About-the-Youth-Venue","2026-03-09","Used official Singleton Council youth venue page for current contact details.","","","true","valid"
"Singleton Family Support","Parent/Carer Support Organisations","Singleton","2330","NSW","The Stables, Corner Bishopgate and Market Streets, Singleton NSW 2330","Singleton","(02) 6572 4288","","https://singletonfamilysupport.org.au/","https://singletonfamilysupport.org.au/contact-us/","family-support,parents,singleton","Local family support organisation with strong direct relevance to parent and carer workshop promotion.","https://singletonfamilysupport.org.au/contact-us/","2026-03-09","Official contact page exposed address and phone; the public email link was not available in the text output so it was left blank.","","","true","missing"
"Muswellbrook Neighbourhood Service","Community Centres & Neighbourhood Houses","Muswellbrook","2333","NSW","QEII Community Centre, Corner Bridge and Market Streets, Muswellbrook NSW 2333","Muswellbrook","02 6542 3555","lclay@uhcs.org.au","https://uhcs.org.au/","https://uhcs.org.au/index.php/programs-and-services/muswellbrook-neighbourhood-service","community-centre,upper-hunter,muswellbrook","Local neighbourhood service with referral, advocacy and emergency-relief links across Muswellbrook communities.","https://uhcs.org.au/index.php/programs-and-services/muswellbrook-neighbourhood-service","2026-03-09","Used official service page and UHCS contact details; manager email is the only clear public email exposed on the official page.","","","true","valid"
"Upper Hunter Family Support Service","Early Childhood & Family Services","Muswellbrook","2333","NSW","QEII Community Centre, Corner Bridge and Market Streets, Muswellbrook NSW 2333","Muswellbrook","02 6542 3555","lclay@uhcs.org.au","https://www.uhcs.org.au/","https://www.uhcs.org.au/index.php/programs-and-services/upper-hunter-family-support-service","family-support,upper-hunter,parenting","Upper Hunter family support service with direct relevance to parents, carers and local referral networks.","https://www.uhcs.org.au/index.php/programs-and-services/upper-hunter-family-support-service","2026-03-09","Used official service page and UHCS public contact details; manager email is the only clear public email exposed on the official page.","","","true","valid"
"Upper Hunter Youth Services","Youth Services","Muswellbrook","2333","NSW","The Showground, 95 Maitland Street, Muswellbrook NSW 2333","Muswellbrook","(02) 6543 4841","","https://www.uhys.org.au/","https://www.uhys.org.au/contact-us/","youth,upper-hunter,muswellbrook","Regional youth service with direct reach into Muswellbrook, Singleton and Upper Hunter young people and families.","https://www.uhys.org.au/contact-us/","2026-03-09","Official contact page exposed phone and address but did not clearly publish a public email in the page text.","","","true","missing"
"Wollongong Youth Services","Youth Services","Wollongong","2500","NSW","41 Burelli Street, Wollongong NSW 2500","Wollongong","(02) 4227 7111","council@wollongong.nsw.gov.au","https://www.wollongong.nsw.gov.au/","https://www.wollongong.nsw.gov.au/community/community-wellbeing/children-and-youth/youth-services","youth,council,illawarra","Council youth service with direct reach into young people, families and local community promotion channels in Wollongong.","https://www.wollongong.nsw.gov.au/community/community-wellbeing/children-and-youth/youth-services","2026-03-09","Used official council youth services page and council contact details.","","","true","valid"
"CareWays Community","Parent/Carer Support Organisations","Port Kembla","2505","NSW","87 Wentworth Street, Port Kembla NSW 2505","Wollongong","(02) 4262 1918","help@careways.org.au","https://www.careways.org.au/","https://www.careways.org.au/contact-us/","family-support,community,illawarra","Community support organisation with strong links to families and carers across the Illawarra.","https://www.careways.org.au/contact-us/","2026-03-09","Used official contact page for current public contact details.","","","true","valid"
"Southern Youth and Family Services (Wollongong Office)","Youth Services","Wollongong","2500","NSW","467 Crown Street, Wollongong NSW 2500","Wollongong","(02) 4221 7700","syfs@syfs.org.au","https://syfs.org.au/","https://syfs.org.au/contact-us/","youth,family,illawarra","Major youth and family service organisation with strong referral and promotion relevance across the Illawarra.","https://syfs.org.au/contact-us/","2026-03-09","Used official contact page Wollongong office details and general public email.","","","true","valid"
"Southern Youth and Family Services (Nowra Office)","Youth Services","Nowra","2541","NSW","107 Berry Street, Nowra NSW 2541","Shoalhaven","(02) 4448 2475","syfs@syfs.org.au","https://syfs.org.au/","https://syfs.org.au/contact-us/","youth,family,shoalhaven","Shoalhaven youth and family service office with strong local referral and promotion relevance.","https://syfs.org.au/contact-us/","2026-03-09","Used official contact page Nowra office details and general public email.","","","true","valid"
"Multicultural Communities Council of Illawarra (Wollongong Office)","Multicultural & Settlement Services","Wollongong","2500","NSW","117 Corrimal Street, Wollongong NSW 2500","Wollongong","02 4229 7566","admin@mcci.org.au","https://mcci.org.au/","https://mcci.org.au/contact-us/","multicultural,settlement,illawarra","Peak multicultural organisation with strong community connections across the Illawarra and South Coast.","https://mcci.org.au/contact-us/","2026-03-09","Used official contact page Wollongong office details.","","","true","valid"
"Multicultural Communities Council of Illawarra (Nowra Office)","Multicultural & Settlement Services","Nowra","2541","NSW","63 Plunkett Street, Nowra NSW 2541","Shoalhaven","02 6169 3986","admin@mcci.org.au","https://mcci.org.au/","https://mcci.org.au/contact-us/","multicultural,settlement,shoalhaven","Shoalhaven office of a major multicultural organisation with strong migrant and refugee community links.","https://mcci.org.au/contact-us/","2026-03-09","Used official contact page Nowra office details.","","","true","valid"
"Coffs Harbour Libraries","Councils & Libraries","Coffs Harbour","2450","NSW","Coffs Harbour Library, 23 Gordon Street, Coffs Harbour NSW 2450","Coffs Harbour","02 6648 4900","library@chcc.nsw.gov.au","https://libraries.coffsharbour.nsw.gov.au/","https://libraries.coffsharbour.nsw.gov.au/About-us/Contact-us","library,council,north-coast","Regional library service with local event, noticeboard and family-program promotion value across Coffs Harbour.","https://libraries.coffsharbour.nsw.gov.au/About-us/Contact-us","2026-03-09","Used official library contact page for public email, phone and Coffs Harbour branch address.","","","true","valid"
"Coffs Harbour Neighbourhood Centre","Community Centres & Neighbourhood Houses","Coffs Harbour","2450","NSW","22 Earl Street, Coffs Harbour NSW 2450","Coffs Harbour","02 6648 3660","","https://chnc.com.au/","https://chnc.com.au/","community-centre,north-coast,families","Established neighbourhood centre with family, counselling and local support networks suitable for workshop outreach.","https://chnc.com.au/","2026-03-09","Official homepage exposed phone and address; no clear public organisation email was captured from the page output.","","","true","missing"
"Northern Rivers Community Gateway","Community Centres & Neighbourhood Houses","Lismore","2480","NSW","186 Molesworth Street, Lismore NSW 2480","Lismore","02 6621 7397","info@nrcg.org.au","https://nrcg.org.au/","https://nrcg.org.au/contact-details/","community-centre,northern-rivers,regional","Regional gateway organisation with broad community support and referral relevance across the Northern Rivers.","https://nrcg.org.au/contact-details/","2026-03-09","Used official contact page for public email, phone and Lismore office address.","","","true","valid"
"Galambila Aboriginal Health Service","Aboriginal & Torres Strait Islander Services","Coffs Harbour","2450","NSW","9 Boambee Street, Coffs Harbour NSW 2450","Coffs Harbour","0266 520 800","reception@galambila.org.au","https://galambila.org.au/","https://galambila.org.au/contact/","aboriginal-health,community,north-coast","Aboriginal community-controlled health service with strong local family and community networks across the Coffs region.","https://galambila.org.au/contact/","2026-03-09","Used official contact page for public reception email, main phone and office address.","","","true","valid"
"Saltwater Freshwater Arts Alliance","Aboriginal & Torres Strait Islander Services","Coffs Harbour","2450","NSW","8 Park Avenue, Coffs Harbour NSW 2450","Coffs Harbour","02 6658 1315","","https://saltwaterfreshwater.com.au/","https://saltwaterfreshwater.com.au/contact/","aboriginal-community,culture,north-coast","Aboriginal-led cultural organisation with strong North Coast community networks and local promotion reach.","https://saltwaterfreshwater.com.au/contact/","2026-03-09","Official contact page exposed office address and phone; public email is handled via website form rather than clearly published text.","","","true","missing"
"headspace Coffs Harbour","Youth Services","Coffs Harbour","2450","NSW","45-53 Little Street, Coffs Harbour NSW 2450","Coffs Harbour","02 6652 1878","hch@healthvoyage.org.au","https://headspace.org.au/","https://headspace.org.au/headspace-centres/coffs-harbour/","youth,mental-health,north-coast","Youth mental health service with strong local family, school and referral links relevant to workshop promotion.","https://headspace.org.au/headspace-centres/coffs-harbour/","2026-03-09","Used official centre page structured data and contact text for phone, email and address.","","","true","valid"
"headspace Port Macquarie","Youth Services","Port Macquarie","2444","NSW","62 Lord Street, Port Macquarie NSW 2444","Port Macquarie-Hastings","02 6588 7300","headspacepm@each.com.au","https://headspace.org.au/","https://headspace.org.au/headspace-centres/port-macquarie/","youth,mental-health,mid-north-coast","Youth mental health service with strong local family, school and referral networks in the Mid North Coast.","https://headspace.org.au/headspace-centres/port-macquarie/","2026-03-09","Used official centre page structured data for phone, email and address.","","","true","valid"
"The Family Centre (Tweed Heads South Office)","Parent/Carer Support Organisations","Tweed Heads South","2486","NSW","Unit 1/14 Amber Road, Tweed Heads South NSW 2486","Tweed","1800 211 154","info@thefamilycentre.org.au","https://thefamilycentre.org.au/","https://thefamilycentre.org.au/the-family-centre-locations/","family-support,parents,northern-rivers","Large Northern Rivers family support organisation with direct relevance to children, young people, and parent/carer outreach.","https://thefamilycentre.org.au/the-family-centre-locations/","2026-03-09","Used official locations page for office address and phone, with public organisation email confirmed on official annual report PDFs hosted on the same domain.","","","true","valid"
"PCYC Tweed Heads","Sport, Recreation & Inclusion Programs","Tweed Heads","2485","NSW","1/4 Florence Street, Tweed Heads NSW 2485","Tweed","(07) 5599 1714","tweedheads@pcycnsw.org.au","https://www.pcycnsw.org.au/","https://www.pcycnsw.org.au/tweed-heads/","sport,recreation,youth,northern-rivers","Local youth and recreation organisation with direct community reach suitable for workshop promotion and referral support.","https://www.pcycnsw.org.au/tweed-heads/","2026-03-09","Used official club page for public phone, email and street address.","","","true","valid"
"headspace Grafton","Youth Services","Grafton","2460","NSW","59 Duke Street, Grafton NSW 2460","Clarence Valley","02 6642 1520","hg@healthvoyage.org.au","https://headspace.org.au/","https://headspace.org.au/headspace-centres/grafton/","youth,mental-health,clarence-valley","Youth mental health service with strong local school, family and referral networks in the Clarence Valley.","https://headspace.org.au/headspace-centres/grafton/","2026-03-09","Used official centre page structured data for phone, email and address.","","","true","valid"
"headspace Lismore","Youth Services","Lismore","2480","NSW","29 Molesworth Street, Lismore NSW 2480","Lismore","02 6625 0200","enquiries@headspace-lismore.org.au","https://headspace.org.au/","https://headspace.org.au/headspace-centres/lismore/","youth,mental-health,northern-rivers","Youth mental health service with strong local school, family and referral links in the Northern Rivers.","https://headspace.org.au/headspace-centres/lismore/","2026-03-09","Used official centre page structured data for phone, email and address.","","","true","valid"
"headspace Armidale","Youth Services","Armidale","2350","NSW","","","(02) 6738 7272","headspaceArmidale@centacarenenw.com.au","https://headspace.org.au/headspace-centres/armidale/","","youth,mental-health,headspace","Youth mental health service covering young people with disability; a key local partner for workshop outreach and referrals.","https://headspace.org.au/headspace-centres/armidale/","2026-03-09","","","","true","generic"
"headspace Ashfield","Youth Services","Ashfield","2131","NSW","","","(02) 9193 8000","headspaceashfield@newhorizons.net.au","https://headspace.org.au/headspace-centres/ashfield/","","youth,mental-health,headspace","Youth mental health service covering young people with disability; a key local partner for workshop outreach and referrals.","https://headspace.org.au/headspace-centres/ashfield/","2026-03-09","","","","true","generic"
"headspace Ballina","Youth Services","Ballina","2478","NSW","","","(02) 6625 0200","reception@headspace-lismore.org.au","https://headspace.org.au/headspace-centres/ballina/","","youth,mental-health,headspace","Youth mental health service covering young people with disability; a key local partner for workshop outreach and referrals.","https://headspace.org.au/headspace-centres/ballina/","2026-03-09","","","","true","generic"
"headspace Bankstown","Youth Services","Bankstown","2200","NSW","","","(02) 9393 9669","headspace.bankstown@flourishaustralia.org.au","https://headspace.org.au/headspace-centres/bankstown/","","youth,mental-health,headspace","Youth mental health service covering young people with disability; a key local partner for workshop outreach and referrals.","https://headspace.org.au/headspace-centres/bankstown/","2026-03-09","","","","true","generic"
"headspace Batemans Bay","Youth Services","Batemans Bay","2536","NSW","","","1800 718 383","info@headspacebatemansbay.org.au","https://headspace.org.au/headspace-centres/batemans-bay/","","youth,mental-health,headspace","Youth mental health service covering young people with disability; a key local partner for workshop outreach and referrals.","https://headspace.org.au/headspace-centres/batemans-bay/","2026-03-09","","","","true","generic"
"headspace Bathurst","Youth Services","Bathurst","2795","NSW","","","(02) 6941 9021","hs.bathurst@marathonhealth.com.au","https://headspace.org.au/headspace-centres/bathurst/","","youth,mental-health,headspace","Youth mental health service covering young people with disability; a key local partner for workshop outreach and referrals.","https://headspace.org.au/headspace-centres/bathurst/","2026-03-09","","","","true","generic"
"headspace Bega","Youth Services","Bega","2550","NSW","","","1800 959 844","info@headspacebega.org.au","https://headspace.org.au/headspace-centres/bega/","","youth,mental-health,headspace","Youth mental health service covering young people with disability; a key local partner for workshop outreach and referrals.","https://headspace.org.au/headspace-centres/bega/","2026-03-09","","","","true","generic"
"headspace Bondi Junction","Youth Services","Bondi Junction","2022","NSW","","","(02) 9366 8800","headspacebondijunction@health.nsw.gov.au","https://headspace.org.au/headspace-centres/bondi-junction/","","youth,mental-health,headspace","Youth mental health service covering young people with disability; a key local partner for workshop outreach and referrals.","https://headspace.org.au/headspace-centres/bondi-junction/","2026-03-09","","","","true","generic"
"headspace Broken Hill","Youth Services","Broken Hill","2880","NSW","","","(02) 9393 9699","headspace.brokenhill@flourishaustralia.org.au","https://headspace.org.au/headspace-centres/broken-hill/","","youth,mental-health,headspace","Youth mental health service covering young people with disability; a key local partner for workshop outreach and referrals.","https://headspace.org.au/headspace-centres/broken-hill/","2026-03-09","","","","true","generic"
"headspace Brookvale","Youth Services","Brookvale","2100","NSW","","","(02) 9937 6500","headspacebrookvale@newhorizons.org.au","https://headspace.org.au/headspace-centres/brookvale/","","youth,mental-health,headspace","Youth mental health service covering young people with disability; a key local partner for workshop outreach and referrals.","https://headspace.org.au/headspace-centres/brookvale/","2026-03-09","","","","true","generic"
"headspace Campbelltown","Youth Services","Campbelltown","2560","NSW","","","(02) 4627 9089","headspace.campbelltown@onedoor.org.au","https://headspace.org.au/headspace-centres/campbelltown/","","youth,mental-health,headspace","Youth mental health service covering young people with disability; a key local partner for workshop outreach and referrals.","https://headspace.org.au/headspace-centres/campbelltown/","2026-03-09","","","","true","generic"
"headspace Camperdown","Youth Services","Camperdown","2050","NSW","","","(02) 9114 4100","headspace.camperdown@sydney.edu.au","https://headspace.org.au/headspace-centres/camperdown/","","youth,mental-health,headspace","Youth mental health service covering young people with disability; a key local partner for workshop outreach and referrals.","https://headspace.org.au/headspace-centres/camperdown/","2026-03-09","","","","true","generic"
"headspace Castle Hill","Youth Services","Castle Hill","2154","NSW","","","(02) 9393 9800","headspace.castlehill@flourishaustralia.org.au","https://headspace.org.au/headspace-centres/castle-hill/","","youth,mental-health,headspace","Youth mental health service covering young people with disability; a key local partner for workshop outreach and referrals.","https://headspace.org.au/headspace-centres/castle-hill/","2026-03-09","","","","true","generic"
"headspace Cessnock","Youth Services","Cessnock","2325","NSW","","","(02) 4993 3450","headspacecessnock@samaritans.org.au","https://headspace.org.au/headspace-centres/cessnock/","","youth,mental-health,headspace","Youth mental health service covering young people with disability; a key local partner for workshop outreach and referrals.","https://headspace.org.au/headspace-centres/cessnock/","2026-03-09","","","","true","generic"
"headspace Cowra","Youth Services","Cowra","2794","NSW","","","(02) 6941 9022","hs.cowra@marathonhealth.com.au","https://headspace.org.au/headspace-centres/cowra/","","youth,mental-health,headspace","Youth mental health service covering young people with disability; a key local partner for workshop outreach and referrals.","https://headspace.org.au/headspace-centres/cowra/","2026-03-09","","","","true","generic"
"headspace Dubbo","Youth Services","Dubbo","2830","NSW","","","(02) 6941 9023","hs.dubbo@marathonhealth.com.au","https://headspace.org.au/headspace-centres/dubbo/","","youth,mental-health,headspace","Youth mental health service covering young people with disability; a key local partner for workshop outreach and referrals.","https://headspace.org.au/headspace-centres/dubbo/","2026-03-09","","","","true","generic"
"headspace Edmondson Park","Youth Services","Edmondson Park","2174","NSW","","","(02) 4604 3060","headspace_edpark@gph.org.au","https://headspace.org.au/headspace-centres/edmondson-park/","","youth,mental-health,headspace","Youth mental health service covering young people with disability; a key local partner for workshop outreach and referrals.","https://headspace.org.au/headspace-centres/edmondson-park/","2026-03-09","","","","true","generic"
"headspace Goulburn","Youth Services","Goulburn","2580","NSW","","","(02) 4824 4944","info@headspacegoulburn.org.au","https://headspace.org.au/headspace-centres/goulburn/","","youth,mental-health,headspace","Youth mental health service covering young people with disability; a key local partner for workshop outreach and referrals.","https://headspace.org.au/headspace-centres/goulburn/","2026-03-09","","","","true","generic"
"headspace Griffith","Youth Services","Griffith","2680","NSW","","","(02) 6962 3277","enquiries@headspacegriffith.org.au","https://headspace.org.au/headspace-centres/griffith/","","youth,mental-health,headspace","Youth mental health service covering young people with disability; a key local partner for workshop outreach and referrals.","https://headspace.org.au/headspace-centres/griffith/","2026-03-09","","","","true","generic"
"headspace Hawkesbury","Youth Services","Richmond","2753","NSW","","","1800 517 171","headspacehawkesbury@uniting.org","https://headspace.org.au/headspace-centres/hawkesbury/","","youth,mental-health,headspace","Youth mental health service covering young people with disability; a key local partner for workshop outreach and referrals.","https://headspace.org.au/headspace-centres/hawkesbury/","2026-03-09","","","","true","generic"
