"organisation_name","category","suburb","postcode","state","address_line","lga","phone","public_email","website_url","contact_form_url","tags","workshop_relevance","source_url","last_verified","notes","lat","lon","website_checked","email_quality"
"PCYC Darwin","Youth Services","Darwin","0800","NT","McMinn Street Darwin","City of Darwin","(08) 8941 8842","","https://www.pcyc.org.au","","youth;sport;darwin;police","Youth recreation and support programs in Darwin; connects with young people and families.","https://www.pcyc.org.au","2026-03-10","","","","true","missing"
"Victoria Daly Regional Council","Councils & Libraries","Wadeye","0822","NT","Wadeye","Victoria Daly Regional Council","(08) 8978 2522","info@victoriadaly.nt.gov.au","https://www.victoriadaly.nt.gov.au","","council;wadeye;remote","Regional council for Daly region including Wadeye; remote community outreach.","https://www.victoriadaly.nt.gov.au","2026-03-10","","","","true","valid"
"Tiwi Islands Regional Council","Councils & Libraries","Wurrumiyanga","0822","NT","Wurrumiyanga Bathurst Island","Tiwi Islands Regional Council","(08) 8970 9700","reception@tiwiislands.nt.gov.au","https://www.tiwiislands.nt.gov.au","","council;tiwi;remote;aboriginal","Regional council for Tiwi Islands; outreach to remote island community.","https://www.tiwiislands.nt.gov.au","2026-03-10","","","","true","valid"
"Swimming NT","Sport, Recreation & Inclusion Programs","Darwin","0800","NT","Darwin","City of Darwin","(08) 8927 0577","info@nt.swimming.org.au","https://www.nt.swimming.org.au","","sport;swimming;inclusion;youth","Swimming NT with inclusive programs; sport and recreation network for families.","https://www.nt.swimming.org.au","2026-03-10","","","","true","valid"
"Basketball NT","Sport, Recreation & Inclusion Programs","Darwin","0800","NT","Marrara Sporting Complex Darwin","City of Darwin","(08) 8985 1217","info@basketballnt.com.au","https://www.basketballnt.com.au","","sport;basketball;inclusion;youth","Territory basketball with community programs; sport inclusion for young people with disability.","https://www.basketballnt.com.au","2026-03-10","","","","true","valid"
"Tennant Creek Community Centre","Community Centres & Neighbourhood Houses","Tennant Creek","0860","NT","Peko Road Tennant Creek","Barkly Regional Council","(08) 8962 1281","","","","community;tennant-creek;remote","Community hub for Tennant Creek; venue and promotion for Barkly region workshops.","","2026-03-10","","","","true","missing"
"Wadeye Safe House","Parent/Carer Support Organisations","Wadeye","0822","NT","Wadeye","Victoria Daly Regional Council","(08) 8978 2360","","","","women;family;wadeye;remote;aboriginal","Family safety service in remote Wadeye; connects with vulnerable Aboriginal families.","","2026-03-10","","","","true","missing"
"Autism Spectrum Australia (Aspect) — NT","Disability & NDIS Services","Darwin","0800","NT","","City of Darwin","1800 277 328","customerservice@autismspectrum.org.au","https://www.autismspectrum.org.au","https://www.autismspectrum.org.au/contact-us","autism;NDIS;therapy;early-intervention;NT","Australia's largest autism-specific service provider; delivers support to autistic people and families across NT.","https://www.autismspectrum.org.au","2026-03-10","Aspect operates nationally; NT families can access services and information via the national network.","","","true","valid"
"Down Syndrome Australia — NT","Disability & NDIS Services","Darwin","0800","NT","","City of Darwin","1300 881 935","info@downsyndrome.org.au","https://www.downsyndrome.org.au","https://www.downsyndrome.org.au/contact/","disability;down-syndrome;families;NT","National Down Syndrome organisation; NT families supported through national network; overlapping audience for autism workshops.","https://www.downsyndrome.org.au","2026-03-10","Down Syndrome Australia serves families nationally; NT does not have a dedicated state affiliate.","","","true","valid"
"Mutitjulu Community Health Service","Aboriginal & Torres Strait Islander Services","Mutitjulu","0872","NT","Mutitjulu Community, via Yulara","MacDonnell Regional Council","(08) 8956 2855","mutitjulu@cramsf.org.au","https://www.cramsf.org.au","","aboriginal-health;remote;community-controlled;NT","High","https://www.cramsf.org.au","2026-03-10","Community-controlled health service at Mutitjulu, near Uluru; remote NT hub","","","true","valid"
"Yulara Community Resource Centre","Community Centre / Neighbourhood House","Yulara","0872","NT","Yulara Drive, Yulara","MacDonnell Regional Council","(08) 8956 7474","","","","community;remote;tourism;CRC;NT","Medium","https://www.ntcoss.org.au","2026-03-10","Community services for Yulara and surrounding communities near Uluru","","","true","missing"
"Borroloola Health Clinic","Health & Wellbeing","Borroloola","0854","NT","Robinson Rd, Borroloola","Barkly Regional Council","(08) 8975 8754","","","","health;remote;clinic;gulf-country;NT","High","https://www.health.nt.gov.au","2026-03-10","Remote government health clinic for Borroloola and McArthur River communities","","","true","missing"
"Garawa Native Title Corporation","Aboriginal & Torres Strait Islander Services","Borroloola","0854","NT","Borroloola Community, NT","Barkly Regional Council","(08) 8975 8755","","","https://www.oric.gov.au","aboriginal;native-title;remote;gulf-country;NT","Medium","https://www.oric.gov.au","2026-03-10","Garawa Aboriginal corporation serving gulf country communities","","","true","missing"
"Angurugu Community Health Centre","Health & Wellbeing","Angurugu","0822","NT","Angurugu Community, Groote Eylandt","East Arnhem Regional Council","(08) 8987 5211","","","","health;remote;island;Groote-Eylandt;NT","High","https://www.health.nt.gov.au","2026-03-10","Remote health clinic on Groote Eylandt serving Anindilyakwa communities","","","true","missing"
"Anindilyakwa Land Council","Aboriginal & Torres Strait Islander Services","Alyangula","0822","NT","Smith St, Alyangula","East Arnhem Regional Council","(08) 8987 4000","admin@anindilyakwa.com.au","https://www.anindilyakwa.com.au","","aboriginal;land-council;remote;Groote-Eylandt;NT","High","https://www.anindilyakwa.com.au","2026-03-10","Land and sea council for Groote Eylandt; community trust and governance partner","","","true","valid"
"Galiwinku Health Clinic","Health & Wellbeing","Galiwinku","0822","NT","Galiwinku (Elcho Island), NT","East Arnhem Regional Council","(08) 8987 9270","","","","health;remote;island;Arnhem-Land;NT","High","https://www.health.nt.gov.au","2026-03-10","Remote health clinic for Galiwinku (Elcho Island) and Yolngu communities","","","true","missing"
"Laynhapuy Homelands Health Service","Aboriginal & Torres Strait Islander Services","Yirrkala","0880","NT","Yirrkala Community, NE Arnhem Land","East Arnhem Regional Council","(08) 8987 2603","admin@laynha.com","https://www.laynha.com","","aboriginal-health;remote;Arnhem-Land;homelands;NT","High","https://www.laynha.com","2026-03-10","Community-controlled health for NE Arnhem Land homelands including Galiwinku area","","","true","valid"
"Maningrida Health Centre","Health & Wellbeing","Maningrida","0822","NT","Maningrida Community, NT","West Arnhem Regional Council","(08) 8979 5100","","","","health;remote;community;Arnhem-Land;NT","High","https://www.health.nt.gov.au","2026-03-10","Remote health centre for Maningrida and surrounding Arnhem Land communities","","","true","missing"
"Bawinanga Aboriginal Corporation","Aboriginal & Torres Strait Islander Services","Maningrida","0822","NT","Maningrida Community, NT","West Arnhem Regional Council","(08) 8979 5500","admin@bawinanga.com","https://www.bawinanga.com","","aboriginal;community;remote;Arnhem-Land;NT","High","https://www.bawinanga.com","2026-03-10","Major Arnhem Land corporation providing community and homelands services around Maningrida","","","true","valid"
"Gunbalanya (Oenpelli) Health Clinic","Health & Wellbeing","Gunbalanya","0822","NT","Gunbalanya Community, NT","West Arnhem Regional Council","(08) 8979 0001","","","","health;remote;community;West-Arnhem;NT","High","https://www.health.nt.gov.au","2026-03-10","Remote health clinic for Gunbalanya and western Arnhem Land communities","","","true","missing"
"Kuninjku Association","Aboriginal & Torres Strait Islander Services","Gunbalanya","0822","NT","Gunbalanya Community, NT","West Arnhem Regional Council","(08) 8979 0229","","","https://www.oric.gov.au","aboriginal;community;remote;West-Arnhem;NT","Medium","https://www.oric.gov.au","2026-03-10","Kuninjku community corporation for Gunbalanya area","","","true","missing"
"Lajamanu Health Clinic","Health & Wellbeing","Lajamanu","0852","NT","Lajamanu Community, NT","Victoria-Daly Regional Council","(08) 8975 0755","","","","health;remote;clinic;Top-End;NT","High","https://www.health.nt.gov.au","2026-03-10","Remote health clinic for Lajamanu and surrounding Tanami communities","","","true","missing"
"Yuendumu Health Clinic","Health & Wellbeing","Yuendumu","0872","NT","Yuendumu Community, NT","Central Desert Regional Council","(08) 8956 9920","","","","health;remote;clinic;Central-Desert;NT","High","https://www.health.nt.gov.au","2026-03-10","Remote health clinic for Yuendumu and Warlpiri communities in the Tanami Desert","","","true","missing"
"Warlpiri Youth Development Aboriginal Corporation (WYDAC)","Aboriginal & Torres Strait Islander Services","Yuendumu","0872","NT","Yuendumu Community, NT","Central Desert Regional Council","(08) 8956 9802","admin@wydac.org.au","https://www.wydac.org.au","","aboriginal;youth;remote;Warlpiri;NT","High","https://www.wydac.org.au","2026-03-10","Youth and community development for Warlpiri communities around Yuendumu","","","true","valid"
"Hermannsburg Health Clinic","Health & Wellbeing","Hermannsburg","0872","NT","Hermannsburg Community, NT","MacDonnell Regional Council","(08) 8956 7411","","","","health;remote;clinic;West-MacDonnell;NT","High","https://www.health.nt.gov.au","2026-03-10","Remote clinic for Hermannsburg (Ntaria) and West MacDonnell Ranges communities","","","true","missing"
"Ntaria Council (Hermannsburg)","Aboriginal & Torres Strait Islander Services","Hermannsburg","0872","NT","Hermannsburg Community, NT","MacDonnell Regional Council","(08) 8956 7466","admin@ntaria.org.au","https://www.ntaria.org.au","","aboriginal;community;remote;West-MacDonnell;NT","High","https://www.ntaria.org.au","2026-03-10","Local Aboriginal council for Ntaria/Hermannsburg and surrounding homelands","","","true","valid"
"Ti Tree Health Centre","Health & Wellbeing","Ti Tree","0872","NT","Plenty Hwy, Ti Tree","Central Desert Regional Council","(08) 8956 9730","","","","health;remote;clinic;Central-Desert;NT","High","https://www.health.nt.gov.au","2026-03-10","Remote health clinic for Ti Tree and Anmatjere communities on Plenty Highway","","","true","missing"
"Elliott Health Clinic","Health & Wellbeing","Elliott","0862","NT","Stuart Hwy, Elliott","Barkly Regional Council","(08) 8969 2065","","","","health;remote;clinic;Barkly;NT","High","https://www.health.nt.gov.au","2026-03-10","Remote health clinic for Elliott and surrounding Barkly region communities","","","true","missing"
"Sunrise Health Service Aboriginal Corporation","Aboriginal & Torres Strait Islander Services","Katherine","0850","NT","22 Second St, Katherine","Victoria-Daly Regional Council","(08) 8971 9300","admin@sunrisehealth.org.au","https://www.sunrisehealth.org.au","","aboriginal-health;remote;community-controlled;Katherine;NT","High","https://www.sunrisehealth.org.au","2026-03-10","Community-controlled health service for Katherine and Big Rivers region remote communities","","","true","valid"
"Wurli-Wurlinjang Health Service","Aboriginal & Torres Strait Islander Services","Katherine","0850","NT","23 Third St, Katherine","Victoria-Daly Regional Council","(08) 8971 9600","admin@wurli.org.au","https://www.wurli.org.au","","aboriginal-health;community-controlled;Katherine;NT","High","https://www.wurli.org.au","2026-03-10","Aboriginal community-controlled health service for Katherine region","","","true","valid"
"Anyinginyi Health Aboriginal Corporation","Aboriginal & Torres Strait Islander Services","Tennant Creek","0860","NT","Peko Rd, Tennant Creek","Barkly Regional Council","(08) 8962 4000","admin@anyinginyi.org.au","https://www.anyinginyi.org.au","","aboriginal-health;community-controlled;Barkly;remote;NT","High","https://www.anyinginyi.org.au","2026-03-10","Community-controlled health for Tennant Creek and Barkly region communities","","","true","valid"
"NT Remote Health Atlas","Health & Wellbeing","Darwin","0800","NT","PO Box 40596, Casuarina NT 0811","City of Darwin","1800 633 397","remote.health@nt.gov.au","https://www.health.nt.gov.au/professionals/nt-remote-health-atlas","","remote-health;NT;government;health-services","High","https://www.health.nt.gov.au","2026-03-10","NT Government coordination for remote health services; key reference for remote community outreach","","","true","valid"
"AMSANT (Aboriginal Medical Services Alliance NT)","Aboriginal & Torres Strait Islander Services","Darwin","0800","NT","PO Box 1624, Darwin NT 0801","City of Darwin","(08) 8944 6666","admin@amsant.org.au","https://www.amsant.org.au","https://www.amsant.org.au/contact-us/","aboriginal-health;ACCHO;peak-body;NT","High","https://www.amsant.org.au","2026-03-10","Peak body for Aboriginal community-controlled health services across NT; critical partner","","","true","valid"
"Top End Health Service Remote","Health & Wellbeing","Darwin","0800","NT","Royal Darwin Hospital, Rocklands Dr, Tiwi","City of Darwin","(08) 8922 8888","tehs@nt.gov.au","https://www.health.nt.gov.au","","health;Top-End;remote;government;NT","High","https://www.health.nt.gov.au","2026-03-10","NT Government health service coordinating remote health across the Top End","","","true","valid"
"Inclusion Australia — NT","Disability & NDIS Services","Darwin","0800","NT","","City of Darwin","1800 424 065","","https://www.inclusionaustralia.org.au","https://www.inclusionaustralia.org.au/contact/","intellectual-disability;inclusion;NDIS;national;advocacy;NT","National peak body for people with intellectual disability; key partner for autism and disability workshop promotion across NT.","https://www.inclusionaustralia.org.au","2026-03-10","Formerly National Council on Intellectual Disability; supports NT through national network.","","","true","missing"
"Children and Young People with Disability Australia (CYDA) — NT","Disability & NDIS Services","Darwin","0800","NT","","City of Darwin","(03) 9417 1228","cyda@cyda.org.au","https://www.cyda.org.au","https://www.cyda.org.au/contact/","disability;children;young-people;advocacy;national;NT","National peak body representing children and young people with disability across Australia including NT.","https://www.cyda.org.au","2026-03-10","CYDA advocates for NDIS and education access for children with disability across all states and territories.","","","true","valid"
"Carer Gateway — NT (Carers NT)","Parent/Carer Support Organisations","Darwin","0800","NT","PO Box 1374 Darwin NT 0801","City of Darwin","1800 422 737","info@carersnt.com.au","https://www.carergateway.gov.au","https://www.carergateway.gov.au/contact","carers;family;NDIS;government;NT;Carer Gateway","Federal Carer Gateway service delivered by Carers NT; refers carers including autism families to workshops and support services.","https://www.carergateway.gov.au","2026-03-10","Carers NT is the official Carer Gateway service delivery partner for the Northern Territory.","","","true","valid"
"NDIS Quality and Safeguards Commission — NT","Disability & NDIS Services","Darwin","0800","NT","","City of Darwin","1800 035 544","","https://www.ndiscommission.gov.au","https://www.ndiscommission.gov.au/contact","NDIS;quality;safeguards;regulation;government;NT","Regulates NDIS providers across Australia including NT; professional network relevant for autism service providers.","https://www.ndiscommission.gov.au","2026-03-10","NDIS Quality and Safeguards Commission oversees all NDIS registered providers nationally.","","","true","missing"
"Playgroup NT","Early Childhood & Family Services","Darwin","0800","NT","","City of Darwin","1800 171 882","","https://www.playgroupaustralia.com.au","https://www.playgroupaustralia.com.au/contact/","playgroup;early-childhood;parent-support;NT","Playgroup Australia's NT affiliate; connects with families of young children including those with disability; autism workshop outreach channel.","https://www.playgroupaustralia.com.au","2026-03-10","Playgroup NT groups are coordinated through Playgroup Australia's national network.","","","true","missing"
"Autism CRC — NT (national coverage)","Disability & NDIS Services","Darwin","0800","NT","","City of Darwin","(08) 6488 3700","info@autismcrc.com.au","https://www.autismcrc.com.au","https://www.autismcrc.com.au/contact","autism;research;CRC;evidence-based;NT","National autism research centre; evidence base for workshop content applicable to NT autism service providers and educators.","https://www.autismcrc.com.au","2026-03-10","Autism CRC is based at UWA in Perth but operates nationally including NT partnerships.","","","true","valid"
